"author","body","score","depth","subreddit","permalink","max_score_at_depth"
"MotherOfKrakens95","It was a gorilla that happened to tell the story, but orangutans are also capable of learning sign language. Theyre just such similar creatures I thought the comparison wouldn't be too far off. His name was Michael- someone was kind enough to post a link to a short youtube video in which he tells the story I mentioned",23,3,"aww","/r/aww/comments/89olz9/baby_orangutan_gets_a_bath/",372
"MotherOfKrakens95","I'm not segregating. I believe all animals are worth about exactly the same in different ways- including humans. And I don't mean to condemn- I only mean to state facts. As I've mentioned below, I don't mean to say Chinese/Vietnamese/etc. People are cruel or ""bad people"", only that they do things very differently and that they are set in their ways. My personal opinion is that they could improve the way their governments treat wildlife, but I understand many people make their living hunting and poaching certain animals and that it is hard for them to change their mindset and the way they live to suit western morality. I don't blame them for that, but I wish every nation on this earth and every human being held the respect for these animals that I feel they deserve. ",2,3,"aww","/r/aww/comments/89olz9/baby_orangutan_gets_a_bath/",372
"Oprahs_snatch","/r/nocontext",75,3,"aww","/r/aww/comments/89olz9/baby_orangutan_gets_a_bath/",372
"DoubleAgentBlumaroo","That looks more like a Lanky than a Chunky.",6,3,"aww","/r/aww/comments/89olz9/baby_orangutan_gets_a_bath/",372
"hitlerthehero","I agree",1,3,"aww","/r/aww/comments/89olz9/baby_orangutan_gets_a_bath/",372
"throwaway125998","[retarded fish frogs] (https://youtu.be/BL9S-TUikfg)

/s... I don't agree but its funny as hell. ",39,3,"aww","/r/aww/comments/89olz9/baby_orangutan_gets_a_bath/",372
"ElBroet","If monkeys turned into humans, why they still monkeys?",1,3,"aww","/r/aww/comments/89olz9/baby_orangutan_gets_a_bath/",372
"maybe_just_happy_","No. God made everything in 7 days, then put two of every living creature on a boat to save the entirety of the planet, except dinosaurs - then Noah, the guy driving the boat, had sex with his family members and restarted human civilization... This all happened like 3000 years ago and the Earth and stuff is only like 4000 years old


...


...


...

...
...


...


...

...

...


...


...

...

...


...


...

...

/s",44,3,"aww","/r/aww/comments/89olz9/baby_orangutan_gets_a_bath/",372
"fatpat","Well, if we evolved from apes, how come they still exist? Checkmate, Darwin!",43,3,"aww","/r/aww/comments/89olz9/baby_orangutan_gets_a_bath/",372
"Who_Decided","It's not that surprising at the end of the day. They prefer to believe that an all-powerful being hand-crafted everyone and every thing, rather than that that all-powerful being would prefer conserving energy and effort and would behave more like a programmer who creates buggy, self-replicating code. ",27,3,"aww","/r/aww/comments/89olz9/baby_orangutan_gets_a_bath/",372
"AnB85","If I could play devil's advocate here. It is because they believe it undermines Christianity. To be honest, they have a point. There are two main arguments here, one trivial and one more serious. The more trivial reason is that it conflicts directly with holy scripture. Most intelligent Christians have found a way to get past that by not taking their Bible too literally and seeing it in the context that it was written. However, the more serious problem which is often overlooked is that evolution shows that it is quite possible for something complicated to come from something simple without any creator necessarily being involved, that the Universe has developed from the bottom up and not designed from the top down. If design can come from order and order can come from chaos, then what purpose is a God? If the Universe can be proved to be possible without God, then it is reasonable to conclude there is no God. Evolution does lead at some point to Atheism. People in the Bible belt instinctively know this. Once you understand Darwinism fully, it is easy to realise that it is a fundamentally dangerous idea for religion.",3,3,"aww","/r/aww/comments/89olz9/baby_orangutan_gets_a_bath/",372
"retro808","Had a friend when I was a teen who attended a die hard christian church and would always argue crazy stuff like all humans came from God's blood and the dirt in the earth everytime evolution was brought up. He also always had a new theory/date for the rapture and when the time would come and pass him and his church always had an excuse why no apocalypse happened. I always thought ""what type of church/religion/God would want you to be living in fear and ignorance like this daily then I realized it was a control tactic later in life.",3,3,"aww","/r/aww/comments/89olz9/baby_orangutan_gets_a_bath/",372
"TheOuroborosProject","/s I think you dropped this ",6,3,"aww","/r/aww/comments/89olz9/baby_orangutan_gets_a_bath/",372
"jaye_taw","Just a slob like one of us",1,3,"aww","/r/aww/comments/89olz9/baby_orangutan_gets_a_bath/",372
"hoopstick","[Ya mon](https://i.ytimg.com/vi/nVV_E6fT-XA/maxresdefault.jpg)",1,3,"aww","/r/aww/comments/89olz9/baby_orangutan_gets_a_bath/",372
"day-owl","It's almost like... humans ARE apes...",372,3,"aww","/r/aww/comments/89olz9/baby_orangutan_gets_a_bath/",372
"wowwoahwow","Had a grad trip to China a few years ago. We visited a zoo. The most memorable part was this family of monkeys that had this one, clearly the alpha male, basically went around humping whichever female was there. Then he saw us, came up the the glass with a full on erection and literally started banging its dick on the glass. It was like some weird display of dominance. ",42,3,"aww","/r/aww/comments/89olz9/baby_orangutan_gets_a_bath/",372
"CloakNStagger","Which is also pretty common.",88,3,"aww","/r/aww/comments/89olz9/baby_orangutan_gets_a_bath/",372
"WHAT-UP_MY-GLIPGLOPS","Wow thinking about that kind of blew my mind.",1,3,"aww","/r/aww/comments/89olz9/baby_orangutan_gets_a_bath/",372
"PuppyBreath","Dogs have them. They’re not creepy. ",19,3,"aww","/r/aww/comments/89olz9/baby_orangutan_gets_a_bath/",372
"Anomalous-Entity","As I understand it, the whites are a human development to make the eyes stand out even more as we depend heavily (understatement, even) on eye movement for social cues. ",2,3,"aww","/r/aww/comments/89olz9/baby_orangutan_gets_a_bath/",372
"BigLongShip","Speak for yourself.   ",1,3,"aww","/r/aww/comments/89olz9/baby_orangutan_gets_a_bath/",372
"Creepy_Disco_Spider","No, we're both primates not apes",-8,3,"aww","/r/aww/comments/89olz9/baby_orangutan_gets_a_bath/",372
"ImEnhanced","🐵",47,3,"aww","/r/aww/comments/89olz9/baby_orangutan_gets_a_bath/",372
"TrollinTrolls","Exactly, that definitely looks like he's smiling the whole time.",2,3,"aww","/r/aww/comments/89olz9/baby_orangutan_gets_a_bath/",372
"CollingwoodLowne","OH GOD I WANT ONE.",2,3,"aww","/r/aww/comments/89olz9/baby_orangutan_gets_a_bath/",372
"Stackhouse_","Why are you the way that you are? I hate everything about the person you choose to be",66,3,"aww","/r/aww/comments/89olz9/baby_orangutan_gets_a_bath/",372
"needhelpmaxing","That's what she said. BAHAHAHAHA",5,3,"aww","/r/aww/comments/89olz9/baby_orangutan_gets_a_bath/",372
"da_funcooker","I think it's very clear what I'm asking. Could a standard size row boat support us?",3,3,"aww","/r/aww/comments/89olz9/baby_orangutan_gets_a_bath/",372
"fearmypoot","also r/animalsbeingbros is great",7,3,"aww","/r/aww/comments/89olz9/baby_orangutan_gets_a_bath/",372
"Manxymanx","I imagine it would be quite difficult to convince the government to sell you that land. It's not like you'll be using it for an industrial purpose so you won't see the same tax returns as say a plantation.

Not to mention you'll need to protect the land against poachers and illegal exploitation from industry. You'll need to hire dozens and dozens of rangers to patrol 24/7 and rely on the local government taking appropriate action against people exploiting your land in such ways. ",21,3,"aww","/r/aww/comments/89olz9/baby_orangutan_gets_a_bath/",372
"Lilpims","Land isn't always for sale. 

But I believe the former CEO of Northwest (I could be wrong about the company: they build outdoorsy sportswear) did exactly this. Bought a huge piece of land in south America and made is a natural reserve. ",3,3,"aww","/r/aww/comments/89olz9/baby_orangutan_gets_a_bath/",372
"the_straw-man","> Because the real solution is to push and lobby governments to ban palm oil, or incentivise the use of an alternative oil.

That's an amazingly less realistic goal. It would be far more productive to work with local governments to establish a protective zone than to try and topple/revolutionize a booming global industry.",13,3,"aww","/r/aww/comments/89olz9/baby_orangutan_gets_a_bath/",372
"Lilpims","And/or make these natural reserve economically smart choices by increasing Green tourism.  ",1,3,"aww","/r/aww/comments/89olz9/baby_orangutan_gets_a_bath/",372
"Poc4e","She fondled his apehood.",46,3,"aww","/r/aww/comments/89olz9/baby_orangutan_gets_a_bath/",372
"Nananananbaa","I too am baby. ",2,3,"aww","/r/aww/comments/89olz9/baby_orangutan_gets_a_bath/",372
"Gravnor","Go away ",2,3,"aww","/r/aww/comments/89olz9/baby_orangutan_gets_a_bath/",372
"MatchuJK","I down voted you because other people were downvoting you for no reason",1,3,"aww","/r/aww/comments/89olz9/baby_orangutan_gets_a_bath/",372
"stewy97","😢",17,3,"aww","/r/aww/comments/89olz9/baby_orangutan_gets_a_bath/",372
"HighPriestofShiloh","Is this the reason they are not more popular at zoos?  They would just look like hairy people having an orgy all the time?  ",22,3,"aww","/r/aww/comments/89olz9/baby_orangutan_gets_a_bath/",372
"2d2c","Bonobos are also more closely related to Humans than any other Ape.",5,3,"aww","/r/aww/comments/89olz9/baby_orangutan_gets_a_bath/",372
"Wiffle_Snuff","I just went down a 2 hour Google rabbit hole and now know more than I need to about Bonobos...",2,3,"aww","/r/aww/comments/89olz9/baby_orangutan_gets_a_bath/",372
"stygger","The horny cousins we rather not talk about! :D",2,3,"aww","/r/aww/comments/89olz9/baby_orangutan_gets_a_bath/",372
"stygger","The uncultured cousins we pretend are not part of the family! :D",1,3,"aww","/r/aww/comments/89olz9/baby_orangutan_gets_a_bath/",372
"sirkeylord","There is controversy around the difference between bonobos and chimps because they are just about the same, the most notable differences being around behaviour and very mild physical traits, you could think of it as being different races, they can still reproduce with each other 

Edit: Apparently I am wrong and there was no controversy at all, genetics are complicated",-2,3,"aww","/r/aww/comments/89olz9/baby_orangutan_gets_a_bath/",372
"HerbalTeaParty","True, bad wording. I meant ""we are very closely related to *other* apes.""",7,3,"aww","/r/aww/comments/89olz9/baby_orangutan_gets_a_bath/",372
"WreakingHavoc640","Give him a washcloth to hold over his eyes/face while you do it. Helped me when trying to convince kids that getting a drop of water on their face wasn’t going to kill them 😄",1,3,"aww","/r/aww/comments/89olz9/baby_orangutan_gets_a_bath/",372
"Panzerbeards","Ooooook!",2,3,"aww","/r/aww/comments/89olz9/baby_orangutan_gets_a_bath/",372
"Cheveyo","Surprise, Apes!",3,3,"aww","/r/aww/comments/89olz9/baby_orangutan_gets_a_bath/",372
"Aruhn","We're going to Candy Mountain Charlie!",249,4,"aww","/r/aww/comments/89olz9/baby_orangutan_gets_a_bath/",249
"Alfalfa_Centauri","But watch yourself counselor...",7,4,"aww","/r/aww/comments/89olz9/baby_orangutan_gets_a_bath/",249
"Motha_Of_Dragons","But watch yourself, McCoy.
",2,4,"aww","/r/aww/comments/89olz9/baby_orangutan_gets_a_bath/",249
"livinglovinlaughing","I realize I'm late to the party but just saw this - make room for one more please..",2,4,"aww","/r/aww/comments/89olz9/baby_orangutan_gets_a_bath/",249
"NiaHoyMenoy","But you watch yourself McCoy",1,4,"aww","/r/aww/comments/89olz9/baby_orangutan_gets_a_bath/",249
"RDAsinister","Even if they were docile, you really shouldn't get too physically comfortable around anything that can rip your arms off. ",18,4,"aww","/r/aww/comments/89olz9/baby_orangutan_gets_a_bath/",249
"RtHonFiend","I wasnt aware of that. I had understood that attacks were virtually unheard of. I know they can, they are very strong.  I just thought they didn't just generally didn't.  I have no specific education or experience to draw on (I just love me an orang documentary) so happy to defer to any professionals in the area. ",4,4,"aww","/r/aww/comments/89olz9/baby_orangutan_gets_a_bath/",249
"LupineChemist","> In Tanjung Balai we ended up in what felt like a Chinese speakeasy alleyway where pork and alcohol were abundant. A bit of an oasis in the largest Muslim country in the world.

Hah, one of our guides at the campsite said ""I'm only a good Muslim in town"" and then just starts smoking a massive joint and passing it around.",40,4,"aww","/r/aww/comments/89olz9/baby_orangutan_gets_a_bath/",249
"magicblufairy","I have heard of corn oil. I have heard of baby oil. Even motor oil. But pain oil? ;)

*I know it is palm oil. Might as well be called pain oil imo*",6,4,"aww","/r/aww/comments/89olz9/baby_orangutan_gets_a_bath/",249
"-ClA-","The “raping” of the earth? Grow a pair dude ",-8,4,"aww","/r/aww/comments/89olz9/baby_orangutan_gets_a_bath/",249
"LupineChemist","Getting to Kuala Lumpur tends to be pretty cheap and flights to all over are crazy cheap from there.",1,4,"aww","/r/aww/comments/89olz9/baby_orangutan_gets_a_bath/",249
"LupineChemist","Yeah, the new airport is really nice.",1,4,"aww","/r/aww/comments/89olz9/baby_orangutan_gets_a_bath/",249
"LupineChemist","I've been slowly cutting it shorter to get my wife used to the idea.",9,4,"aww","/r/aww/comments/89olz9/baby_orangutan_gets_a_bath/",249
"LupineChemist","https://en.wikipedia.org/wiki/Sumatran_orangutan",3,4,"aww","/r/aww/comments/89olz9/baby_orangutan_gets_a_bath/",249
"knoth3ad","Even in organic baby formula. ",133,4,"aww","/r/aww/comments/89olz9/baby_orangutan_gets_a_bath/",249
"jacobsever","Solution: Drink black coffee",93,4,"aww","/r/aww/comments/89olz9/baby_orangutan_gets_a_bath/",249
"SuperSaiyan5wag","It doesn't look like its in monster energy drink. Phew, dodged that bullet.",48,4,"aww","/r/aww/comments/89olz9/baby_orangutan_gets_a_bath/",249
"eman00619","check your deodorant ",18,4,"aww","/r/aww/comments/89olz9/baby_orangutan_gets_a_bath/",249
"EatenByWeirdFishes","Let me direct you to r/Coffee, right this way please.",3,4,"aww","/r/aww/comments/89olz9/baby_orangutan_gets_a_bath/",249
"SarahMcDiddy","Here is a really good link for alternatives that also shows **over 200 other names for palm oil** : [link](http://www.travelfordifference.com/list-palm-oil-free-products/) ",54,4,"aww","/r/aww/comments/89olz9/baby_orangutan_gets_a_bath/",249
"Stupid_question_bot","Not Doritos.. NOOoooOooOoooO",47,4,"aww","/r/aww/comments/89olz9/baby_orangutan_gets_a_bath/",249
"TEXzLIB","Why would they use it instead of regular good old crude oil derived products in industrial lubricants?",8,4,"aww","/r/aww/comments/89olz9/baby_orangutan_gets_a_bath/",249
"disneylovesme","Let us not forget the most loved Nutella . ",11,4,"aww","/r/aww/comments/89olz9/baby_orangutan_gets_a_bath/",249
"morecupcakethanhuman","~~I just bought some Doritos (some chili lime flavored ones) and and I don't see palm oil listed? The ones I bought are the rolled Doritos if that makes a difference~~

NVM. I checked the link given by another redditor below. Fucking vegetable oil",3,4,"aww","/r/aww/comments/89olz9/baby_orangutan_gets_a_bath/",249
"WestOfAnfield","There is a great brand out of Australia called Thank You and I've fallen in love with their story and I find them highly admirable in their quest to end poverty. They make fantastic products and they identify whether it is vegan, contains palm oil, whether it is tested on animals, etc.


[Their 100% model](https://thankyou.co/structure)

[I've been using this hand wash](https://thankyou.co/products/botanical-lime-coriander-hand-wash)",2,4,"aww","/r/aww/comments/89olz9/baby_orangutan_gets_a_bath/",249
"Athiri","Oreos contain  palm oil. That was a sad day when I found that out. Also so does most cheap peanut butter. I buy the 100% peanuts stuff now.",1,4,"aww","/r/aww/comments/89olz9/baby_orangutan_gets_a_bath/",249
"FreeMyMen","Never have run into a plant based milk with palm oil in it myself and vegans are more aware than any of the problems with palm oil so it wouldn't make sense for the milks to have it anyways. Literally have like four different top brand plant based milks in my refrigerator right now and not one has palm oil in it and again, I've never come across one that has.",1,4,"aww","/r/aww/comments/89olz9/baby_orangutan_gets_a_bath/",249
"snapmehummingbirdeb","Can we come up with a list of products to make it easy?",1,4,"aww","/r/aww/comments/89olz9/baby_orangutan_gets_a_bath/",249
"Corporation_tshirt","So true. The more processed food is, the more unhealthy it is for you. Save a magnificent orangutan: eat an apple!",2,4,"aww","/r/aww/comments/89olz9/baby_orangutan_gets_a_bath/",249
"CloudsOfDust","I’ve done this as much as possible over the last 5-10 years.  I try to stay on the outside areas of grocery stores rather than the interior aisles.  It’s made me a much better cook, and I feel healthier in general.  Now if I try some prepackaged food, it tastes really over seasoned and salty.  I had some chicken fingers at a friend’s house during an NCAA tournament party a couple weeks ago and felt like I had to drink 5 glasses of water to get the thirsty salt taste out of my mouth.  ",2,4,"aww","/r/aww/comments/89olz9/baby_orangutan_gets_a_bath/",249
"snapmehummingbirdeb","That seems easy enough",1,4,"aww","/r/aww/comments/89olz9/baby_orangutan_gets_a_bath/",249
"AL-AL-AL","Chef Ramsay over here doesn't buy packaged food.",-3,4,"aww","/r/aww/comments/89olz9/baby_orangutan_gets_a_bath/",249
"MarcellecraM","They are not using the same reddish unrefined oil you may know. The industrial product is refined, deodorized and bleached, so it's just a neutral yellowish oil.

If your oil does not originate from Indonesia or Malaysia, and the plant is cultivated locally then it's perfectly good to use.

  


The problem stems from greedy people clearing the forests in those two countries to plant oil palm tree monocultures. Which is where the Orang-Utan lives. So the species is now critically endangered, just because palm oil is extremely cheap to produce.

Any other common refined/treated vegetable oil could be used instead. But Oil palms are so efficient at producing oil that greed wins.
  


Funny (or not so much) anecdote: There is milk substitute available for calves that only contains 30% milk powder and the rest is palm (and coconut) oil. Which is completely insane. We'd rather drink the milk ourselves than feed the calves and destroy the only natural habitat of the emotionally closest thing to humans.",25,4,"aww","/r/aww/comments/89olz9/baby_orangutan_gets_a_bath/",249
"ip_g_chodder","Because it's cheaper",13,4,"aww","/r/aww/comments/89olz9/baby_orangutan_gets_a_bath/",249
"Tex-Rob","Just a guess based on what you said, but maybe the strong taste means you can use less?  shrug",4,4,"aww","/r/aww/comments/89olz9/baby_orangutan_gets_a_bath/",249
"greatpiginthesty","If you Google it, there are multiple sites that have all the different names it has. Also I'm appalled to learn that it's in, like, all shampoos and soaps. ",3,4,"aww","/r/aww/comments/89olz9/baby_orangutan_gets_a_bath/",249
"SarahMcDiddy","Check out this link for **over 200 other names for palm oil** [link](http://www.travelfordifference.com/list-palm-oil-free-products/) ",3,4,"aww","/r/aww/comments/89olz9/baby_orangutan_gets_a_bath/",249
"morecupcakethanhuman","Check this awesome redditors comment. They link to a [list of 200+ alternative names for palm oil](As someone working at a company that currently do...

https://www.reddit.com/r/AskReddit/comments/89exuo/ok_reddit_what_just_isnt_worth_the_effort/dwrbzey?utm_source=reddit-android)",1,4,"aww","/r/aww/comments/89olz9/baby_orangutan_gets_a_bath/",249
"IceColdKofi","Where are you from?",1,4,"aww","/r/aww/comments/89olz9/baby_orangutan_gets_a_bath/",249
"jpmassena","> comprehensive list of foods with palm oil

Is it [this](https://drpongo.files.wordpress.com/2012/01/productpalmoillist2012flexweek.pdf) one? 

To link a PDF, just copy the PDF URL directly from google results",10,4,"aww","/r/aww/comments/89olz9/baby_orangutan_gets_a_bath/",249
"nearly_almost","I did not know this about costs rica. :/",1,4,"aww","/r/aww/comments/89olz9/baby_orangutan_gets_a_bath/",249
"MarcellecraM","Yep, per area of land used to produce oil the oil palm is by far the most efficient.",2,4,"aww","/r/aww/comments/89olz9/baby_orangutan_gets_a_bath/",249
"Juicedupmonkeyman","Also the oils have different types of fats. A flaky delicious baked good cooked with palm/coconut/butter won't be as flaky because of the types of fat found in corn oil (unless it's hydrogenated). ",2,4,"aww","/r/aww/comments/89olz9/baby_orangutan_gets_a_bath/",249
"barbershoptroll","Let me sleep on it.",8,4,"aww","/r/aww/comments/89olz9/baby_orangutan_gets_a_bath/",249
"doft","Pretty major point, Sumatra has orangutans as well. ",13,4,"aww","/r/aww/comments/89olz9/baby_orangutan_gets_a_bath/",249
"the_straw-man","You're an absolute idiot. Both of those places are reputable orangutan rehabilitation centers.",1,4,"aww","/r/aww/comments/89olz9/baby_orangutan_gets_a_bath/",249
"ilovetotour","Is it those type of volunteering where you pay to volunteer ? ",17,4,"aww","/r/aww/comments/89olz9/baby_orangutan_gets_a_bath/",249
"GabyCakes420","I think what he's trying to say is that unlike chimpanzees, humans go out of their way to destroy another living creatures home for self profit. A chimp is aggressive for hunting, and protection. ",1,4,"aww","/r/aww/comments/89olz9/baby_orangutan_gets_a_bath/",249
"the_straw-man","It depends on the group. Not all groups are warlike. Just like humans, researchers are realizing that culture can exist in non-human apes. ",1,4,"aww","/r/aww/comments/89olz9/baby_orangutan_gets_a_bath/",249
"sirius4778","I was at a zoo and made eye contact with an adult gorilla. I seriously questioned whether it was a human in a mask the connection was so sincere. It felt like he was telling me ""I don't belong in here"". Definitely surreal, I feel bad for great apes in zoos even if it helps with the species overall they are so close to us it's heartbreaking. ",50,4,"aww","/r/aww/comments/89olz9/baby_orangutan_gets_a_bath/",249
"Athiri","IIRC the only animal that has asked a question was Alex, the Grey Parrot. He had been learning to identify colours, looked at himself in the mirror and asked ""what colour?""",6,4,"aww","/r/aww/comments/89olz9/baby_orangutan_gets_a_bath/",249
"Pigoonlet","Look into some of the work with bonobos and parrots regarding questions.",2,4,"aww","/r/aww/comments/89olz9/baby_orangutan_gets_a_bath/",249
"BothFarmer",">damn cute


They're fucking terrifying mate.


Source: got robbed by a monkey in Hyderabad",19,4,"aww","/r/aww/comments/89olz9/baby_orangutan_gets_a_bath/",249
"BatOnWeb","Hmm I don't know I think if Chimps had our tech they would be as bad as us if not worse.
Hell they have their own Wars.",2,4,"aww","/r/aww/comments/89olz9/baby_orangutan_gets_a_bath/",249
"MotherOfKrakens95","How can you be so sure of that though? All animals (and even some research on plants suggest this) feel pain. All animals feel fear. Some are maybe capable of more complex emotions, I suppose, but every creature has the same basic set of feelings. And regardless of how they feel, they should be granted the respect they deserve, because I think they're here for a purpose as important as any other living thing's purpose. I'll use your own example: The little, gross earth worm is largely responsible for keeping ecosystems healthy, and green, and the breaking down of decaying matter. Without that little earth worm we'd be in a load of shit, pun intended. Just saying, every critter serves some purpose in this world.  Even if you can't relate to it or understand it ",3,4,"aww","/r/aww/comments/89olz9/baby_orangutan_gets_a_bath/",249
"Great_Beans","Im not saying all animals are exactly the same, but surely all animals ""feel"" at the very least. What their experience of that feeling is, who knows, but my point is that it is beyond me how anyone who has spent time with even lower life forms could be indifferent to their suffering or want to cause it themselves",1,4,"aww","/r/aww/comments/89olz9/baby_orangutan_gets_a_bath/",249
"dylan76","We're only the worst because we have the means to do more harm than any other species. Everything evil that we do, is done by other species. Other species just do it on a smaller scale or with the limitations that come from lacking our technology. ",7,4,"aww","/r/aww/comments/89olz9/baby_orangutan_gets_a_bath/",249
"lambocinnialfredo","Nope. That's hippos. Total assholes. ",1,4,"aww","/r/aww/comments/89olz9/baby_orangutan_gets_a_bath/",249
"GasOnFire","It was your comment of ""merely animals"" that caused me to think you're segregating. As you said, we're all animals. ""Merely"" is not applicable, ",1,4,"aww","/r/aww/comments/89olz9/baby_orangutan_gets_a_bath/",249
"DownvoteDaemon","Your username is repulsive lol..",20,4,"aww","/r/aww/comments/89olz9/baby_orangutan_gets_a_bath/",249
"Manthes","He has no style.",1,4,"aww","/r/aww/comments/89olz9/baby_orangutan_gets_a_bath/",249
