"author","body","score","depth","subreddit","permalink","max_score_at_depth"
"DigitalBullets612","True. My SO has always had GSDs so we wanted to give Mals a try. If we eventually get more land we would like to have more Mals and possibly do some breeding. Who knows where the future will take us! ",3,9,"aww","/r/aww/comments/89p7e4/pretty_sure_he_hates_his_new_hat/",4
"phishsihd","Get a Dutch Shepherd. ",3,9,"aww","/r/aww/comments/89p7e4/pretty_sure_he_hates_his_new_hat/",4
"ip_g_chodder","Good lookin dog!

This here is Zelda https://imgur.com/a/HJeRY",2,1,"aww","/r/aww/comments/89p7e4/pretty_sure_he_hates_his_new_hat/",245
"ip_g_chodder","I've heard they're basically identical to Mals.",1,1,"aww","/r/aww/comments/89p7e4/pretty_sure_he_hates_his_new_hat/",245
"DigitalBullets612","Any preferred attributes?",1,1,"aww","/r/aww/comments/89p7e4/pretty_sure_he_hates_his_new_hat/",245
"DigitalBullets612","Oh wow she’s beautiful!!! ",1,2,"aww","/r/aww/comments/89p7e4/pretty_sure_he_hates_his_new_hat/",57
"phishsihd","Pretty much. ",1,2,"aww","/r/aww/comments/89p7e4/pretty_sure_he_hates_his_new_hat/",57
"Speckintime","Wow! That fur 😍",16,0,"aww","/r/aww/comments/89szrk/brought_home_this_little_bundle_of_joy_last/",16
"Cubsfan78","What a beautiful dog!",7,0,"aww","/r/aww/comments/89szrk/brought_home_this_little_bundle_of_joy_last/",16
"satanisthegoodguy","he looks like a good boi",8,0,"aww","/r/aww/comments/89szrk/brought_home_this_little_bundle_of_joy_last/",16
"skamapanda","What breed of dog is this? Asking for a frend",5,0,"aww","/r/aww/comments/89szrk/brought_home_this_little_bundle_of_joy_last/",16
"tunedfortrash","Happy dog!",4,0,"aww","/r/aww/comments/89szrk/brought_home_this_little_bundle_of_joy_last/",16
"ColorMySorrow","How beautiful! What breed is this?",5,0,"aww","/r/aww/comments/89szrk/brought_home_this_little_bundle_of_joy_last/",16
"samantha_rosie","Wow, my dog looks just like your dog but miniature! [Here is Zoey.](https://imgur.com/a/aeTXr) How weird that the most similar dog I’ve seen to her is so much bigger. ",3,0,"aww","/r/aww/comments/89szrk/brought_home_this_little_bundle_of_joy_last/",16
"finallyprettyhappy","Aussie? nova Scotia duck tolling retriever? what a beauty!!",2,0,"aww","/r/aww/comments/89szrk/brought_home_this_little_bundle_of_joy_last/",16
"famousevan","Oh my god you found my long lost dog! :p",2,0,"aww","/r/aww/comments/89szrk/brought_home_this_little_bundle_of_joy_last/",16
"lordturbo801","I see no bundled thing",1,0,"aww","/r/aww/comments/89szrk/brought_home_this_little_bundle_of_joy_last/",16
"PM_ME_UR_DOGSHIT","This good girl need pets and or scritches, STAT!!",1,0,"aww","/r/aww/comments/89szrk/brought_home_this_little_bundle_of_joy_last/",16
"Kalasynful","Such a handsome floof!! ",1,0,"aww","/r/aww/comments/89szrk/brought_home_this_little_bundle_of_joy_last/",16
"MelloMaster","Remember that dogs like love being brushed as well as scritches. Will also save you some vacuuming.",1,0,"aww","/r/aww/comments/89szrk/brought_home_this_little_bundle_of_joy_last/",16
"Barsnip","Your dog has eyebrows.",1,0,"aww","/r/aww/comments/89szrk/brought_home_this_little_bundle_of_joy_last/",16
"kickassvashti","What’s his name?",1,0,"aww","/r/aww/comments/89szrk/brought_home_this_little_bundle_of_joy_last/",16
"tiaradactyl","Why in the world would someone give him up in the first place? Glad you have him now!",1,0,"aww","/r/aww/comments/89szrk/brought_home_this_little_bundle_of_joy_last/",16
"neinerr","He so soft ",1,0,"aww","/r/aww/comments/89szrk/brought_home_this_little_bundle_of_joy_last/",16
"Iwouldliketoorder","Yes he is lovely and fluffy :) love him ",14,1,"aww","/r/aww/comments/89szrk/brought_home_this_little_bundle_of_joy_last/",14
"Iwouldliketoorder","He IS a very good boy :) rarely barks, follows you around and wiggles his entire body when you come home from work.",14,1,"aww","/r/aww/comments/89szrk/brought_home_this_little_bundle_of_joy_last/",14
"Iwouldliketoorder","He is an Icelandic sheepdog ",2,1,"aww","/r/aww/comments/89szrk/brought_home_this_little_bundle_of_joy_last/",14
"Iwouldliketoorder","He is an Icelandic sheepdog ",2,1,"aww","/r/aww/comments/89szrk/brought_home_this_little_bundle_of_joy_last/",14
"Iwouldliketoorder","Icelandic sheepdog :)",2,1,"aww","/r/aww/comments/89szrk/brought_home_this_little_bundle_of_joy_last/",14
"Iwouldliketoorder","He will is getting brushed weekly :)",2,1,"aww","/r/aww/comments/89szrk/brought_home_this_little_bundle_of_joy_last/",14
"Iwouldliketoorder","Thor, his parents had Icelandic names so he is named from Nordic mythology ",2,1,"aww","/r/aww/comments/89szrk/brought_home_this_little_bundle_of_joy_last/",14
"Iwouldliketoorder","We are his third owners in little over a year. His first owner got divorced and had to give him up, he then lived for 4 months with a lady who had a 12 year old dog. Her other dog did not accept him and bullied him around constantly so she had to give him up. So we have taken him in. He is my first dog, my SO has a ton of dog experience though so both him and me are learning.

He is such a nice and calm dog. Very intelligent and eager to learn :) 
",3,1,"aww","/r/aww/comments/89szrk/brought_home_this_little_bundle_of_joy_last/",14
"pandaismymuse","Want to get him a friend now ?",9,0,"aww","/r/aww/comments/89ujtz/he_found_a_new_friend/",9
"QueenCoffeeBean83","My guy hates mirror-cat. They're sworn enemies.",4,0,"aww","/r/aww/comments/89ujtz/he_found_a_new_friend/",9
"gangstercomputer","those eyes!",3,0,"aww","/r/aww/comments/89ujtz/he_found_a_new_friend/",9
"estoka","What kinda kitty is that?",2,0,"aww","/r/aww/comments/89ujtz/he_found_a_new_friend/",9
"scooby04","*all I want to do is sniff ur butt*",1,0,"aww","/r/aww/comments/89ujtz/he_found_a_new_friend/",9
"darkbro66","My cat has always completely ignored mirrors. This is all I wanted, but noooo",1,0,"aww","/r/aww/comments/89ujtz/he_found_a_new_friend/",9
"FlamingHail","I've fooound a brand new best friend,

And it's me!",1,0,"aww","/r/aww/comments/89ujtz/he_found_a_new_friend/",9
"melplp","He did patty cake with new friend at begging ",1,0,"aww","/r/aww/comments/89ujtz/he_found_a_new_friend/",9
"MxCherryBlue","Happened to me something like this once",1,0,"aww","/r/aww/comments/89ujtz/he_found_a_new_friend/",9
"Chakinfingerz","What kind of cat is this? I'm asking because my gf said her father and mother and 80% of her family are allergic to cats. So now I'm actively cat shopping. ",1,0,"aww","/r/aww/comments/89ujtz/he_found_a_new_friend/",9
"LufefuL","He needs a buddy :(",1,0,"aww","/r/aww/comments/89ujtz/he_found_a_new_friend/",9
"neutralperson6","I can’t! 
*cries*",1,0,"aww","/r/aww/comments/89ujtz/he_found_a_new_friend/",9
"Evilbit77","Now, now. Perfectly symmetrical violence never solved anything. ",1,0,"aww","/r/aww/comments/89ujtz/he_found_a_new_friend/",9
"webo2456","r/DumbCat",1,0,"aww","/r/aww/comments/89ujtz/he_found_a_new_friend/",9
"Dumindrin","They’re so beeg!",1,1,"aww","/r/aww/comments/89ujtz/he_found_a_new_friend/",1
"Calogero_Ignazio","4 Kittens, 2 skunks, a raccoon and a deer walk into a bar",2003,0,"aww","/r/aww/comments/89ospr/its_baby_season/",2003
"zDracula","What an odd but equally adorable collection of lil animals. ",804,0,"aww","/r/aww/comments/89ospr/its_baby_season/",2003
"Fiatach","I like how that one racoon just casually walking over everyone",775,0,"aww","/r/aww/comments/89ospr/its_baby_season/",2003
"mrath_infinitus","This looks like the woodlands critters Christmas crew ",758,0,"aww","/r/aww/comments/89ospr/its_baby_season/",2003
"barbeermann95","Where do I purchase one of these combo boxes?",581,0,"aww","/r/aww/comments/89ospr/its_baby_season/",2003
"fedawg","Looks like a casting call for a live-action Bambi. That raccoon is like, ""I can totally pull off Thumper.""",282,0,"aww","/r/aww/comments/89ospr/its_baby_season/",2003
"DeterministDiet","The deer is like, I want to play, but my mommy told me to stay right here.",145,0,"aww","/r/aww/comments/89ospr/its_baby_season/",2003
"DeterministDiet","The little skunk who faceplants just threw me over the cuteness edge.  Pretty sure this is /sub.",100,0,"aww","/r/aww/comments/89ospr/its_baby_season/",2003
"holyfiddlesticks","Oh my. My heart can only take so much.",66,0,"aww","/r/aww/comments/89ospr/its_baby_season/",2003
"Mumblerumble","Well, I just made a noise not befitting a 33 year old man. Thanks for the daily dose of adorable.",51,0,"aww","/r/aww/comments/89ospr/its_baby_season/",2003
"FaceTHEGEEB","Baby Skunks seem very cute. But are they?",38,0,"aww","/r/aww/comments/89ospr/its_baby_season/",2003
"Slain61","South park?",39,0,"aww","/r/aww/comments/89ospr/its_baby_season/",2003
"jball429","OP is Snow White.",27,0,"aww","/r/aww/comments/89ospr/its_baby_season/",2003
"TheOnlyBooman","Am i the only one thinking of the South Park version of the cute woddland creatures?",20,0,"aww","/r/aww/comments/89ospr/its_baby_season/",2003
"GrandmaTITMilk","Let me tell you. I use to volunteer at a wildlife refuge and we would get those baby skunks in every year. They get spooked easily and so do their glands that hold all their vile nose perfume. It was a great day when they were old enough to be moved to the outdoor enclosures. 
",18,0,"aww","/r/aww/comments/89ospr/its_baby_season/",2003
"IrateIndian42","""Honey I brought a couple of friends over!""",10,0,"aww","/r/aww/comments/89ospr/its_baby_season/",2003
"CSwapJack8","What is that black creature just sitting there? Is it dead?
",11,0,"aww","/r/aww/comments/89ospr/its_baby_season/",2003
"bluerosebox2","There must be a Disney princess nearby",11,0,"aww","/r/aww/comments/89ospr/its_baby_season/",2003
"sleepyhead2016","This is beyond adorable",7,0,"aww","/r/aww/comments/89ospr/its_baby_season/",2003
"Farren246","Two kitties, two stinky kitties, one trash kitty and a filthy deer.",7,0,"aww","/r/aww/comments/89ospr/its_baby_season/",2003
"teizhen","It's repost season!",8,0,"aww","/r/aww/comments/89ospr/its_baby_season/",2003
"bfunk07","Let's play,'guess how many times this has been reposted'",7,0,"aww","/r/aww/comments/89ospr/its_baby_season/",2003
"ellensundies","TIL a baby deer isn't all that much bigger than a baby skunk, volume-wise. 

That is one heck of a box of cuteness you've got there. ",7,0,"aww","/r/aww/comments/89ospr/its_baby_season/",2003
"zachynix","This is Bambi irl 😍",7,0,"aww","/r/aww/comments/89ospr/its_baby_season/",2003
"YOURMOMMASABITCH","Axis dear are open season year round in Texas. Keep an eye on that guy if you live in the south. ",4,0,"aww","/r/aww/comments/89ospr/its_baby_season/",2003
"Salmuth","I may not have enough pokeballs...",5,0,"aww","/r/aww/comments/89ospr/its_baby_season/",2003
"Platypushat","The baby deer is like “if I just sit here quietly, I’m sure my mom will be right back...”",5,0,"aww","/r/aww/comments/89ospr/its_baby_season/",2003
"bladex70","Is that a skunk? ",4,0,"aww","/r/aww/comments/89ospr/its_baby_season/",2003
"Dick_Demon","What the fuck is this shitty reddit video hosting? How do I get the link to just the video?",4,0,"aww","/r/aww/comments/89ospr/its_baby_season/",2003
"phillhb","Is it weird that i want the racoon?",5,0,"aww","/r/aww/comments/89ospr/its_baby_season/",2003
"dkbe1983","You just won the Internet.",3,0,"aww","/r/aww/comments/89ospr/its_baby_season/",2003
"TooShiftyForYou","The Bambi live-action reboot cast is coming along nicely!",3,0,"aww","/r/aww/comments/89ospr/its_baby_season/",2003
"A1A5KA","It is like a live action Disney cartoon.",3,0,"aww","/r/aww/comments/89ospr/its_baby_season/",2003
"uni_and_internet","How does this happen?!?! ",3,0,"aww","/r/aww/comments/89ospr/its_baby_season/",2003
"13crew","Awww, those little baby skunks 💜",3,0,"aww","/r/aww/comments/89ospr/its_baby_season/",2003
"ColdBeerz","HAIL SATAN",3,0,"aww","/r/aww/comments/89ospr/its_baby_season/",2003
"Conniptions_gives","you have many strange cats",3,0,"aww","/r/aww/comments/89ospr/its_baby_season/",2003
"BlackFlag187","Yay, blood orgy!",3,0,"aww","/r/aww/comments/89ospr/its_baby_season/",2003
"nullsie","Haillllll satan!",3,0,"aww","/r/aww/comments/89ospr/its_baby_season/",2003
"okcumputer","Ratings:

Skunk

Raccoon

Deer

Kittens

Kittens are always cute, but they are everywhere.  Baby skunks on the other hand, will take number 1 spot every time.",3,0,"aww","/r/aww/comments/89ospr/its_baby_season/",2003
"Psych-adin","What the hell? Is this Snow White's woodland creature veterinary center?",3,0,"aww","/r/aww/comments/89ospr/its_baby_season/",2003
"Dreadedsemi","Coon: this doesn't make sense. ",2,0,"aww","/r/aww/comments/89ospr/its_baby_season/",2003
"D3Rp_DaWg","This looks like something from a fairytale",2,0,"aww","/r/aww/comments/89ospr/its_baby_season/",2003
"NozhaXBL","What is going on there! Looks like a new Bambi movie is coming.",2,0,"aww","/r/aww/comments/89ospr/its_baby_season/",2003
"TIME_2_MAGA","The stumbling skunk faceplant is too cute. ",2,0,"aww","/r/aww/comments/89ospr/its_baby_season/",2003
"Techgiraffe","I will never ever complain about this being reposted. 😍😍😍",2,0,"aww","/r/aww/comments/89ospr/its_baby_season/",2003
"troyantipastomisto","Couldn’t find thumper ",2,0,"aww","/r/aww/comments/89ospr/its_baby_season/",2003
"NonstopSuperguy","Wabbit season.",2,0,"aww","/r/aww/comments/89ospr/its_baby_season/",2003
"dranide","Just so everyone is aware, The count is 4 kittens, 1 deer, 2 skunks and 1 raccoon.",2,0,"aww","/r/aww/comments/89ospr/its_baby_season/",2003
"peanutbutterpud","Oh man those little skunks! ",2,0,"aww","/r/aww/comments/89ospr/its_baby_season/",2003
"jake-flash","I won’t the lil raccoon",2,0,"aww","/r/aww/comments/89ospr/its_baby_season/",2003
"Einfaltspinsel","Disney princess starter pack! :)",2,0,"aww","/r/aww/comments/89ospr/its_baby_season/",2003
"lioninawhat","Reminds me of [Woodland Critter Christmas](https://i.imgflip.com/1spxia.jpg).",2,0,"aww","/r/aww/comments/89ospr/its_baby_season/",2003
"i-come","Baby skunks are the cutest",2,0,"aww","/r/aww/comments/89ospr/its_baby_season/",2003
"slow_worker","Pretty sure my ovaries just exploded. And I'm a man.",2,0,"aww","/r/aww/comments/89ospr/its_baby_season/",2003
"CrustyMcballs","I’ve never seen baby skunks before. They’re so cute!!",2,0,"aww","/r/aww/comments/89ospr/its_baby_season/",2003
"PassionateRomp","TIL baby skunks are the cutest of them all",2,0,"aww","/r/aww/comments/89ospr/its_baby_season/",2003
"thetoastistaken","That baby skunk!!!!! 😍😍",2,0,"aww","/r/aww/comments/89ospr/its_baby_season/",2003
"Sweet_Taurus0728","WHY AREN'T YOU LOVING ALL OF THEM YOU MONSTER???",2,0,"aww","/r/aww/comments/89ospr/its_baby_season/",2003
"joesmithtron","That black ""kitten"" is actually a baby bear.
Change my mind!",2,0,"aww","/r/aww/comments/89ospr/its_baby_season/",2003
"Monkeytravler","Remeber that south park episode? I don't trust them...",2,0,"aww","/r/aww/comments/89ospr/its_baby_season/",2003
"wlfn90","We found a fawn once.  We saw it sitting on the side of a trail in the woods behind our house.  After a few of hours we went back and checked and he was still there so we took him home with us.  We bottle fed him, and we learned that cow milk gives fawns the worst diarrhea and that they need milk replacer instead.  I think the one we got was intended for baby goats.  This was before you could google the right way to take care of them. 

He was really nice and was always excited to see people, wagged his tail kind of like a dog.  He couldn’t walk on linoleum, slid around like it was ice.  Poor little thing, I always wonder if his mom was okay and was coming back for him but we kidnapped him.",2,0,"aww","/r/aww/comments/89ospr/its_baby_season/",2003
"fuckmordor420","The skunks are hilarious. ",2,0,"aww","/r/aww/comments/89ospr/its_baby_season/",2003
"Cyndikate","If I had these cuties anywhere near me I won’t be able to contain myself. 

I want to pet them so bad. 

Gaw. I want to pet SOMETHING. ",2,0,"aww","/r/aww/comments/89ospr/its_baby_season/",2003
"angry_pecan","OK those baby skunks just made my day.  

The rest are awesome & cute, but  *the skunks!*.

",2,0,"aww","/r/aww/comments/89ospr/its_baby_season/",2003
"zwingo","I live on a golf course that has had deer roaming for many generations, so much so that they don’t mind people anymore. They will nap five feet from the tee, and just watch people golf, or if you are in your garden they will walk right up to you and eat a plant a foot away. But the one thing they still don’t fuck around with are their babies. I have watched multiple dumbass golfers try to pet the babies laying in the grass, only to get chased off by multiple full grown momma deer.

I tell you all that because every year for a few months I have to employ every last bit of my power to not go pick up and cuddle those adorable little things. They are just so damn cute.

It also sucks because when the herd roams through the neighborhood to munch plants, you gotta chase them off your lawn. If you don’t your plants are dead. Not that hard with the adults, but when you go out to yell at them, and a tiny baby is standing there nibbling the end of the lowest plant, it’s near impossible to go through with it. ",2,0,"aww","/r/aww/comments/89ospr/its_baby_season/",2003
"theanonwonder","This was almost too much adorableness to handle! Some chicks and it would have definitely made me explode. (Phrasing?)",2,0,"aww","/r/aww/comments/89ospr/its_baby_season/",2003
"3lluukkee3","This reminds me of the woodlands creature episode of Southpark. ",2,0,"aww","/r/aww/comments/89ospr/its_baby_season/",2003
"NecrumOddBoy","They are saying, ""All hail the dark Lord satan!.""",2,0,"aww","/r/aww/comments/89ospr/its_baby_season/",2003
"SpacecadetBell","Those are some strange looking kittens",2,0,"aww","/r/aww/comments/89ospr/its_baby_season/",2003
"pvviking123","Baby skunks are way cuter than they should be",2,0,"aww","/r/aww/comments/89ospr/its_baby_season/",2003
"Matty_Ice0","It’s Woodland Critter Christmas! Blood Orgy!",2,0,"aww","/r/aww/comments/89ospr/its_baby_season/",2003
"solidshakego","Shit...it's a woodland critter christmas


hail satan",2,0,"aww","/r/aww/comments/89ospr/its_baby_season/",2003
"saysnicething","If I had 100 upvotes to give...",2,0,"aww","/r/aww/comments/89ospr/its_baby_season/",2003
"pamplemousse2","Oh my gawd the skunks I'm dying",2,0,"aww","/r/aww/comments/89ospr/its_baby_season/",2003
"ebr23rd","What is this? Disney?",2,0,"aww","/r/aww/comments/89ospr/its_baby_season/",2003
"Iamnotburgerking","u/remotectrl ",1,0,"aww","/r/aww/comments/89ospr/its_baby_season/",2003
"incredible69","What if one of the skunk farts ?",1,0,"aww","/r/aww/comments/89ospr/its_baby_season/",2003
"Sneeko","I don't know how this came to be, but I *do* know that I want to take part in whatever it is.",1,0,"aww","/r/aww/comments/89ospr/its_baby_season/",2003
"Dman42997","It's like fucking Bambi in there",1,0,"aww","/r/aww/comments/89ospr/its_baby_season/",2003
"DifficultJellyfish","So very many babies!  Can't handle the cute.",1,0,"aww","/r/aww/comments/89ospr/its_baby_season/",2003
"Princess_Thranduil","This is what I want to be greeted with when I die.",1,0,"aww","/r/aww/comments/89ospr/its_baby_season/",2003
"ChumleyEX","<3
",1,0,"aww","/r/aww/comments/89ospr/its_baby_season/",2003
"tattoo_traveler","The cast of Bambi reunite",1,0,"aww","/r/aww/comments/89ospr/its_baby_season/",2003
"Qwerty22435","You mean Bambi season!!",1,0,"aww","/r/aww/comments/89ospr/its_baby_season/",2003
"LowBoysenberry","It’s Bambi!",1,0,"aww","/r/aww/comments/89ospr/its_baby_season/",2003
"ayemef","Did someone just go around stealing juvenile wildlife? This is fucked up.",1,0,"aww","/r/aww/comments/89ospr/its_baby_season/",2003
"Christ45","Opening scene from Bambi? Did I just age myself? ",1,0,"aww","/r/aww/comments/89ospr/its_baby_season/",2003
"kokrull","Adventures of Coon and Friends!!",1,0,"aww","/r/aww/comments/89ospr/its_baby_season/",2003
"4gotOldU-name","Someone grabbed a ""box of spring cuteness"" from Mother Nature, and opened it up. ",1,0,"aww","/r/aww/comments/89ospr/its_baby_season/",2003
"skenwood","The fawn is done with this",1,0,"aww","/r/aww/comments/89ospr/its_baby_season/",2003
"sushipusha","The one twitchy skunk reminded me of the little octopus from Nemo. ""Sorry, I sprayed.""",1,0,"aww","/r/aww/comments/89ospr/its_baby_season/",2003
"sixpackshaker","Keep the white paint away from the black kitten, or the skunks with go full Harvey Weinstein on her.",1,0,"aww","/r/aww/comments/89ospr/its_baby_season/",2003
"jacyerickson","How cute! From the thumbnail I thought they were all guinea pigs. I was pleasantly surprised when I opened the clip. hehe ",1,0,"aww","/r/aww/comments/89ospr/its_baby_season/",2003
"Quevo","I dont know the title but im pretty sure this is a Disney movie",1,0,"aww","/r/aww/comments/89ospr/its_baby_season/",2003
"mykol_reddit","Is this the cast of the Bambi live action remake? ",1,0,"aww","/r/aww/comments/89ospr/its_baby_season/",2003
"ahhbebe","Oh them skunks get me every dam time ",1,0,"aww","/r/aww/comments/89ospr/its_baby_season/",2003
"Wildkarrde_","That's a good way to transfer parasites between unrelated species.",1,0,"aww","/r/aww/comments/89ospr/its_baby_season/",2003
"ShrimpToothpaste","Its forest fire season!

Pretty sure these are orphans from a forest fire",1,0,"aww","/r/aww/comments/89ospr/its_baby_season/",2003
"tigerlady13","The cute explosion! My eyes!",1,0,"aww","/r/aww/comments/89ospr/its_baby_season/",2003
"ManfredTheCat","Who are you? Snow white?",1,0,"aww","/r/aww/comments/89ospr/its_baby_season/",2003
"qwixx7","A rare look behind the scenes during the making of Bambi! (No animals were hurt in the making of this production)",1,0,"aww","/r/aww/comments/89ospr/its_baby_season/",2003
"soryazlawl","Reminds me of [https://youtu.be/pQtAIvYHXLw](South Park forest critters)",1,0,"aww","/r/aww/comments/89ospr/its_baby_season/",2003
"MEANMEANPORK","Okay, that does it. I’m getting skunks!

(Not really. BUT THEY’RE SO CUTE)",1,0,"aww","/r/aww/comments/89ospr/its_baby_season/",2003
"SunilSimha","Hello, yes I'd like to sign up to be a Disney Princess",1,0,"aww","/r/aww/comments/89ospr/its_baby_season/",2003
"termedea","Cuteness overload! How is it even possible to keep this variety of species in the same place? 

I just love that little fella, can't really make out what animal he is, who just crashes into everything and everyone. He seems to have some issues, poor thing.",1,0,"aww","/r/aww/comments/89ospr/its_baby_season/",2003
"Schumi3891","Too much cuteness. Can't handle it",1,0,"aww","/r/aww/comments/89ospr/its_baby_season/",2003
"Salmuth","I may not have enough pokeballs...",1,0,"aww","/r/aww/comments/89ospr/its_baby_season/",2003
"metcwill333","Cuteness overload",1,0,"aww","/r/aww/comments/89ospr/its_baby_season/",2003
"elcoinmusk","Are you stealing them in the forest to their real parents? ",1,0,"aww","/r/aww/comments/89ospr/its_baby_season/",2003
"llamma","Is that a fucking skunk? ",1,0,"aww","/r/aww/comments/89ospr/its_baby_season/",2003
"dandannyordaniel","It’s awesome seeing the fawn’s instinct is to stay still and not draw attention to itself by predators, no matter what is going on. ",1,0,"aww","/r/aww/comments/89ospr/its_baby_season/",2003
"JimmyJoestar","I swear I saw this post before some where.......can someone help me out?",1,0,"aww","/r/aww/comments/89ospr/its_baby_season/",2003
"solena","it's like Bambi IRL!",1,0,"aww","/r/aww/comments/89ospr/its_baby_season/",2003
"PM_ME_THICKBOOTY","Wtf is this shit? How?",1,0,"aww","/r/aww/comments/89ospr/its_baby_season/",2003
"Bahndoos","Dude, why you gotta bring skunks to the party?!",1,0,"aww","/r/aww/comments/89ospr/its_baby_season/",2003
"justvince87","Literally the cast of Bambi",1,0,"aww","/r/aww/comments/89ospr/its_baby_season/",2003
"IHateEveryone-","Question, how did you do this?",1,0,"aww","/r/aww/comments/89ospr/its_baby_season/",2003
"flyguysd","They are all friendly now but when they grow up that skunk will become an apex preditor as demonstrated in the documentary Loony Tunes.",1,0,"aww","/r/aww/comments/89ospr/its_baby_season/",2003
"nmc9279","Ok I cannot take this ",1,0,"aww","/r/aww/comments/89ospr/its_baby_season/",2003
"BinkWinkleman","Deery the Deer, Squirrely the Squirrel, Rabbity the Rabbit, Beavery the Beaver, Beary the Bear, Porcupiney the Porcupine, Skunky the Skunk, Foxy the Fox,  Woodpeckery the Woodpecker, Mousey the Mouse, Raccoony the Raccoon and Chickadee-y the Chickadee.",1,0,"aww","/r/aww/comments/89ospr/its_baby_season/",2003
"joszma","Cast for the live-action “Bambi”?",1,0,"aww","/r/aww/comments/89ospr/its_baby_season/",2003
"scottamus_prime","Are you making a live action Disney film?",1,0,"aww","/r/aww/comments/89ospr/its_baby_season/",2003
"Rev_Jim_lgnatowski","First to escape: raccoon or one of the kittens? Place your bets!",1,0,"aww","/r/aww/comments/89ospr/its_baby_season/",2003
"Dyeode","I would watch this live feed",1,0,"aww","/r/aww/comments/89ospr/its_baby_season/",2003
"Dedod_2","What live action Disney movie is this?",1,0,"aww","/r/aww/comments/89ospr/its_baby_season/",2003
"aquietheart","which disney princess is OP",1,0,"aww","/r/aww/comments/89ospr/its_baby_season/",2003
"livelong2000","I remember that scene from Bambi!",1,0,"aww","/r/aww/comments/89ospr/its_baby_season/",2003
"Amorganskate","Literally we just need a bear and a porcupine and we have the winter animals from south park",1,0,"aww","/r/aww/comments/89ospr/its_baby_season/",2003
"MangDynasty","HEY MA, CAN WE GET SOME MILK!?
THE MILK! WE WANT IT NOW!",1,0,"aww","/r/aww/comments/89ospr/its_baby_season/",2003
"In_here_Im_the_rat","The fawn just wishing everyone would sit the fuck down. ",1,0,"aww","/r/aww/comments/89ospr/its_baby_season/",2003
"_bin0","Bambi?",1,0,"aww","/r/aww/comments/89ospr/its_baby_season/",2003
"donttouchmymompls","Hail Satan!!",1,0,"aww","/r/aww/comments/89ospr/its_baby_season/",2003
