"author","body","score","depth","subreddit","permalink","max_score_at_depth"
"eff_this_shiz","Watching someone die of lung cancer destroys you in ways I never thought possible. The drug commercials want you to think it'll all be okay, but it won't. Lung cancer has a less than ten percent five-year survival  rate. Fuck hose commercials, and fuck cancer. Wishing you the best, OP. Feel free to PM me if you ever need to talk to someone. Serious offer. ",3,4,"aww","/r/aww/comments/89s9ga/patient_dog_walks_extremely_slow_so_that_the_old/",258
"witeowl","Fuck, depression is no joke. I'm sorry that it's destroyed your mother's life and impacted your own. Good on you for taking care of her, but make sure to take care of yourself as well (easier said than done, I know). ",2,4,"aww","/r/aww/comments/89s9ga/patient_dog_walks_extremely_slow_so_that_the_old/",258
"disaffectedmisfit","I’m headed down this route, depression due in part to a lot of joint pain, but this post is the most inspiring thing I’ve ever seen.",2,4,"aww","/r/aww/comments/89s9ga/patient_dog_walks_extremely_slow_so_that_the_old/",258
"silversatire","Having had many dogs over the years, of varying intelligence, I guarantee you all but the Kevins of the dog world get it when there’s something wrong or limiting with their bonded human. The smart ones even understand age in humans as well as other dogs, and the smart ones who aren’t assholes will adjust their behavior to that as well as illness. ",46,5,"aww","/r/aww/comments/89s9ga/patient_dog_walks_extremely_slow_so_that_the_old/",137
"kingzandshit","we got a mass murderer here 

",11,5,"aww","/r/aww/comments/89s9ga/patient_dog_walks_extremely_slow_so_that_the_old/",137
"genskeeper","I thought ‘Marley and Me’ was hard to get through . I almost couldn’t make it to the end of ‘A Dog’s Purpose’. I sobbed at every chapter end. Wasn’t as fond of the second one though. ",7,5,"aww","/r/aww/comments/89s9ga/patient_dog_walks_extremely_slow_so_that_the_old/",137
"Lil_Tidepod","We appreciate your honesty",5,5,"aww","/r/aww/comments/89s9ga/patient_dog_walks_extremely_slow_so_that_the_old/",137
"Zahnanigans","Well happy birthday buddy. May you have a better day tomorrow and an even better birthday next year.",5,5,"aww","/r/aww/comments/89s9ga/patient_dog_walks_extremely_slow_so_that_the_old/",137
"BobT21","I might be spending too much time on reddit.  Just found that I have 72,000 karma.  Dunno how that rates in the great game of life.",7,5,"aww","/r/aww/comments/89s9ga/patient_dog_walks_extremely_slow_so_that_the_old/",137
"phyxius90","Where else should the money be spent? Wars? Going to Mars? Of course there are issues and problems in the world that need money and resources besides longevity, however I think we can afford to put a little more funding and resources into the research. At the moment it has none because most people don't see it as a viable or even possible thing to achieve and a large portion are just too negative and think they'll miss the boat anyway to see the benefits themselves. 

To achieve longevity lots of things need to be solved. All the common diseases that we are more subject to when we age like cancer, cardiovascular disease, parkinsons and alzheimer’s need to be taken care of. The amount of money that is spent to support people with these conditions is substantial. Age care is a huge industry. What if we could take that away? People won't get the diseases of old age and we can all concentrate on walking our dogs. Once we cure aging we may not even need a cure for diseases of old age as they will already be taken care of like alzheimer’s. 

Now as for the classic statement of 'it will only be for the rich'. Yes, you are correct, it will be. Initially. However as time passes (5-10 years) and the technology establishes and the manufacturing processes are made more efficient it will inevitably become cheaper. Significantly cheaper. There will be a huge demand for it and companies will want to capitalise. China will likely mass produce the technology and before you know it it'll be available at walmart or coles.",1,5,"aww","/r/aww/comments/89s9ga/patient_dog_walks_extremely_slow_so_that_the_old/",137
"im_not_THAT_stoopid","But we could all chip in and buy him that cart!",137,5,"aww","/r/aww/comments/89s9ga/patient_dog_walks_extremely_slow_so_that_the_old/",137
"grandpadrokz","Its free :(",10,5,"aww","/r/aww/comments/89s9ga/patient_dog_walks_extremely_slow_so_that_the_old/",137
"Ms_Iambic_Pentagram","Maybe you will when you're that old . It's coming for you!",1,5,"aww","/r/aww/comments/89s9ga/patient_dog_walks_extremely_slow_so_that_the_old/",137
"tmntfever","You couldn’t even afford it.",1,5,"aww","/r/aww/comments/89s9ga/patient_dog_walks_extremely_slow_so_that_the_old/",137
"dante_flame",">	i didnt ~~buy~~ **get a permission slip for** this feel trip

FTFY",1,5,"aww","/r/aww/comments/89s9ga/patient_dog_walks_extremely_slow_so_that_the_old/",137
"Bllq21","And on his 93th birthday she started using the wheelchair so she could avoid using the motorized wheelchair someone gave her. ",17,5,"aww","/r/aww/comments/89s9ga/patient_dog_walks_extremely_slow_so_that_the_old/",137
"hannahhart411","This! Honestly if you don’t use it, you lose it. This little walk for as long as he can could be the difference between him being independent and having someone have to help him to the toilet every time. ",60,5,"aww","/r/aww/comments/89s9ga/patient_dog_walks_extremely_slow_so_that_the_old/",137
"tomorrowistomato","This exactly. Exercise is critical for maintaining mobility as you age, even if exercise for you is just walking down the street and back. ",1,5,"aww","/r/aww/comments/89s9ga/patient_dog_walks_extremely_slow_so_that_the_old/",137
"Rt266","That doggo is almost literally keeping this guy alive.  <Ear scratches>",6,5,"aww","/r/aww/comments/89s9ga/patient_dog_walks_extremely_slow_so_that_the_old/",137
"vozahlaas","And a masochist. He cuts himself.",1,5,"aww","/r/aww/comments/89s9ga/patient_dog_walks_extremely_slow_so_that_the_old/",137
"Wobbling","He could prolly do with a Zimmer frame but I'm not sure his arms are up to taking on more load. Being old just sucks. Props to him for staying out of a chair. 

Young people: be good to your joints.  Stretch. Don't be fat in your prime. **Build and maintain core strength**.

Source: mid 40s dude who didn't understand the importance of this shit in my 20s and 30s. Don't be like me. ",12,5,"aww","/r/aww/comments/89s9ga/patient_dog_walks_extremely_slow_so_that_the_old/",137
"duaneap","I agree with everything you said but the dude in the video you linked is still in very good knick. ",1,5,"aww","/r/aww/comments/89s9ga/patient_dog_walks_extremely_slow_so_that_the_old/",137
"VerySecretCactus","Not employed, but I also conclude that this conclusion is conclusive.",2,5,"aww","/r/aww/comments/89s9ga/patient_dog_walks_extremely_slow_so_that_the_old/",137
"nv1226","Yeah i don’t care about that lol I’m not OP",1,5,"aww","/r/aww/comments/89s9ga/patient_dog_walks_extremely_slow_so_that_the_old/",137
"brenno-hippie","Works better how? Is it a more complete ease of pain, does it last longer? What gives it a benefit over synth? I have my fingers crossed that it does become legal for you soon. I've been producing cannabis and cannabis extracts for about a decade now, first medicinally and now recreationally. (We made 72,000 grams of oil last week!) I do what I do for you, people like you, because I don't want you to be in pain any more. If you ingest cannabis orally I would suggest getting a gram of distillate which will be 1000mg of thc. And You can just eat that alone or mixed with anything.  ",3,5,"aww","/r/aww/comments/89s9ga/patient_dog_walks_extremely_slow_so_that_the_old/",137
"Deviljho_Dirt","Same",7,5,"aww","/r/aww/comments/89s9ga/patient_dog_walks_extremely_slow_so_that_the_old/",137
"MysticWitDaMelody","Yeah me too :( ",1,5,"aww","/r/aww/comments/89s9ga/patient_dog_walks_extremely_slow_so_that_the_old/",137
"bunchedupwalrus","Don't feel too guilty. The fact that you cared enough to want her to stay isn't the worst thing a person can do

Personally I'm in favor of people being allowed to pass in situations like that, and it sounds like her wishes were respected in the end. I hope you can find some peace in it all",4,5,"aww","/r/aww/comments/89s9ga/patient_dog_walks_extremely_slow_so_that_the_old/",137
"Tryxy","After I had some time to digest the news that’s where my head went too. Why spend your last few months in pain and suffering, withering away in a bed. That’s not time worth spending. I don’t want her to suffer, she’s making the right choice for her and I respect that. It’s selfish of me to be upset with her wanting to take her death into her own hands. I’m just going to miss the hell out of her, she’s an outstanding woman and deserves peace.",5,5,"aww","/r/aww/comments/89s9ga/patient_dog_walks_extremely_slow_so_that_the_old/",137
"ifntchingyu","Yeah i didnt really like the girl in the 2nd, but i like the way he never paid attention to her bad parts and loved her anyways",5,6,"aww","/r/aww/comments/89s9ga/patient_dog_walks_extremely_slow_so_that_the_old/",100
"djcrodjcrodjcro","And we appreciate your openness about your appreciation. ",1,6,"aww","/r/aww/comments/89s9ga/patient_dog_walks_extremely_slow_so_that_the_old/",100
"sdc4491","Hey. Thanks man. ",2,6,"aww","/r/aww/comments/89s9ga/patient_dog_walks_extremely_slow_so_that_the_old/",100
"thevulturesbecame","That means people valued your contributions to discussions at least 72,000 times which is pretty cool when you think about it! Especially since it's not based on popularity or anything (like a social media account full of attractive photos might get more likes than someone else). It's all based on what you have to say :)",2,6,"aww","/r/aww/comments/89s9ga/patient_dog_walks_extremely_slow_so_that_the_old/",100
"Caelum_Cantorus","We should do that as a society yes, but here we are",100,6,"aww","/r/aww/comments/89s9ga/patient_dog_walks_extremely_slow_so_that_the_old/",100
"Babydontcomeback","Yes we should because we can. How can we do this?",22,6,"aww","/r/aww/comments/89s9ga/patient_dog_walks_extremely_slow_so_that_the_old/",100
"PashaBear-_-","It’s people like you that make reddit so incredibly wonderful. Seriously dude, the fact that people were on board to buy him this cart was so willingly was a tear jerker. ",3,6,"aww","/r/aww/comments/89s9ga/patient_dog_walks_extremely_slow_so_that_the_old/",100
"daemon7","Or we can up vote, and then move on to kids falling over. Hmm... choices choices ",2,6,"aww","/r/aww/comments/89s9ga/patient_dog_walks_extremely_slow_so_that_the_old/",100
"hrhdhrhrhrhrbr","Is there no cure for that arched back?",2,6,"aww","/r/aww/comments/89s9ga/patient_dog_walks_extremely_slow_so_that_the_old/",100
"cheboulder","Is a scotter free in Argentina? ",1,6,"aww","/r/aww/comments/89s9ga/patient_dog_walks_extremely_slow_so_that_the_old/",100
"GulGarak","Then on her 94th birthday she started using the motorized wheelchair to avoid using the coffin someone bought her.",37,6,"aww","/r/aww/comments/89s9ga/patient_dog_walks_extremely_slow_so_that_the_old/",100
"TheChance","> I'm not sure his arms are up to taking on more load.

Seems to me any wheeled walker would put roughly 50% *less* load on the one arm =P",1,6,"aww","/r/aww/comments/89s9ga/patient_dog_walks_extremely_slow_so_that_the_old/",100
"Jellogirl","Last longer, usually kicks in sooner and does a better job I've found. 




I'm in Canada so it should be legal anytime now...

TY for doing what you do! I really do appreaciate people like you for figuring out what works best and breeding new strains and whatnot to make it even better!",2,6,"aww","/r/aww/comments/89s9ga/patient_dog_walks_extremely_slow_so_that_the_old/",100
"TheChance","> We made 72,000 grams of oil last week

jesus fuck, how many thousands of kilos of flower was that...",1,6,"aww","/r/aww/comments/89s9ga/patient_dog_walks_extremely_slow_so_that_the_old/",100
"Bobias",":(",1,6,"aww","/r/aww/comments/89s9ga/patient_dog_walks_extremely_slow_so_that_the_old/",100
"Zahnanigans","No problem, man. Sometimes the best cure is to just hear someone say it'll be better tomorrow.",1,7,"aww","/r/aww/comments/89s9ga/patient_dog_walks_extremely_slow_so_that_the_old/",23
"GarboMan","Because forcing to good is better than choosing to do good? ",-60,7,"aww","/r/aww/comments/89s9ga/patient_dog_walks_extremely_slow_so_that_the_old/",23
"Thorhand","For all we know this a pretty old video (and it sure looks like it by the quality of the camera), and this guy may be in a better place. ",23,7,"aww","/r/aww/comments/89s9ga/patient_dog_walks_extremely_slow_so_that_the_old/",23
"im_not_THAT_stoopid","I was hoping someone would post his name or something, but that’s a long shot ",5,7,"aww","/r/aww/comments/89s9ga/patient_dog_walks_extremely_slow_so_that_the_old/",23
"im_not_THAT_stoopid","Thanks it’s just too bad we can’t. But let me know if you find something out. I’m on board. ",2,7,"aww","/r/aww/comments/89s9ga/patient_dog_walks_extremely_slow_so_that_the_old/",23
"Doobz87","Not at that age. A surgery to fix that would likely be a killer :/

Source: had that surgery",6,7,"aww","/r/aww/comments/89s9ga/patient_dog_walks_extremely_slow_so_that_the_old/",23
"cubanohermano","On her 95th birthday she fucked a coconut and ended up using the coffin anyway",2,7,"aww","/r/aww/comments/89s9ga/patient_dog_walks_extremely_slow_so_that_the_old/",23
"brenno-hippie","Thank you for sharing with me, I really appreciate it. The more I know, the better I can focus on making things more suitable for the people using it seriously. ",1,7,"aww","/r/aww/comments/89s9ga/patient_dog_walks_extremely_slow_so_that_the_old/",23
"brenno-hippie","A lot haha. Today at work I found myself saying ""ugh this is only a 5lb bag, I need more."" 2 years ago a quarter pound was a lot to me. ",1,7,"aww","/r/aww/comments/89s9ga/patient_dog_walks_extremely_slow_so_that_the_old/",23
"sdc4491","Damn straight. I'll make sure to pass on your positivity to someone else who also needs ut. ",4,8,"aww","/r/aww/comments/89s9ga/patient_dog_walks_extremely_slow_so_that_the_old/",42
"Caelum_Cantorus","God go away. Only people like you get mad about society taking care of old people. It's disgusting",42,8,"aww","/r/aww/comments/89s9ga/patient_dog_walks_extremely_slow_so_that_the_old/",42
"Babydontcomeback","looking at again I suspect that you are correct.
It reminded me of a dog that I had to put down because she got sick. I broke my back a few years ago and knew something was wrong. Instead of jumping up she just looked down slowly wagged her tail. I made me sad to see her sad. Best Good Girl ever.",21,8,"aww","/r/aww/comments/89s9ga/patient_dog_walks_extremely_slow_so_that_the_old/",42
"sniper2233","heaven?",1,8,"aww","/r/aww/comments/89s9ga/patient_dog_walks_extremely_slow_so_that_the_old/",42
"Babydontcomeback","I think Thorhand is correct
""from Thorhand via /r/aww sent 13 minutes ago
""For all we know this a pretty old video (and it sure looks like it by the quality of the camera), and this guy may be in a better place.""",1,8,"aww","/r/aww/comments/89s9ga/patient_dog_walks_extremely_slow_so_that_the_old/",42
"Rt266","Iz you dead?

TIL: I can talk to dead people.",7,8,"aww","/r/aww/comments/89s9ga/patient_dog_walks_extremely_slow_so_that_the_old/",42
"TheChance","Oh, how times change! When I lived with an MMJ patient, my standards and expectations likewise shifted.

Still, 72kg of oil, I suppose the bulk of that was solvent, but *wow* =P you have a cool job.",1,8,"aww","/r/aww/comments/89s9ga/patient_dog_walks_extremely_slow_so_that_the_old/",42
"kizzle69","It really is disgusting.

The least we can do is give those before us some damn comfort in their lives.",12,9,"aww","/r/aww/comments/89s9ga/patient_dog_walks_extremely_slow_so_that_the_old/",12
"Osama_bin_meming","They're not mad about taking care of society, rather that society is forced to do it in the first place. If you want to help someone I implore you to do it, find others with the same mindset and you can go a long way, but forcing people against their will to do anything for the ""greater good"" isnt a justified reason of coercion. ",-17,9,"aww","/r/aww/comments/89s9ga/patient_dog_walks_extremely_slow_so_that_the_old/",12
"GarboMan","Yes, it's disgusting that I believe people should consciously choose to help people, rather than be coerced to do so.  Coercion is disgusting.",-29,9,"aww","/r/aww/comments/89s9ga/patient_dog_walks_extremely_slow_so_that_the_old/",12
"OhNoTyPo","Hey I just wanted to reach out and say that it was good to see a story like this. I lost my pup recently under sudden and unexpected circumstances. I miss her a lot and it’s always nice to know other people have gone through the same things.",10,9,"aww","/r/aww/comments/89s9ga/patient_dog_walks_extremely_slow_so_that_the_old/",12
"Thorhand","Heaven?
A comfy bed surrounded by loving family?
A better and more beautiful city than the one he was filmed in?
....

I’m leaving it open for interpretation ",1,9,"aww","/r/aww/comments/89s9ga/patient_dog_walks_extremely_slow_so_that_the_old/",12
"Doobz87","Sorry to burst your dead-people-talking bubble lol",3,9,"aww","/r/aww/comments/89s9ga/patient_dog_walks_extremely_slow_so_that_the_old/",12
"brenno-hippie","No that's final product, the ppm solvent is so low it can't be measured. I LOVE my job. It's amazing. I just hope I get to keep it for a long time and Jeff sessions  doesn't take it from me. 

We were 61% of the wax market in Washington state last month. 190k-400k people got stoned on oil I made. ",1,9,"aww","/r/aww/comments/89s9ga/patient_dog_walks_extremely_slow_so_that_the_old/",12
"Caelum_Cantorus",">telling an anarchist about voluntary association",4,1,"aww","/r/aww/comments/89s9ga/patient_dog_walks_extremely_slow_so_that_the_old/",1070
"OodalollyOodalolly","I would like to live in place where people like this just get help without having to be an internet sensation with a crowdfund. Just give it to them.",11,1,"aww","/r/aww/comments/89s9ga/patient_dog_walks_extremely_slow_so_that_the_old/",1070
"liveinutah","Yes people should* do it however coersion is how the rest of society gets stuff done.",7,1,"aww","/r/aww/comments/89s9ga/patient_dog_walks_extremely_slow_so_that_the_old/",1070
"Caelum_Cantorus",">Telling an anarchist about voluntary association",3,1,"aww","/r/aww/comments/89s9ga/patient_dog_walks_extremely_slow_so_that_the_old/",1070
"Gork862","I agree, but I don’t think the person you originally responded to was trying to say we should be forced to give money to these people. I think it was more that we as a society really should all be choosing to give out some money, at least when we can. I personally think it is a choice of the individual whether to help others or not, but I wouldn’t spend my time arguing with people on the internet about it...",1,1,"aww","/r/aww/comments/89s9ga/patient_dog_walks_extremely_slow_so_that_the_old/",1070
"Caelum_Cantorus","Go away, you whiny ""libertarian"" capitalist",1,1,"aww","/r/aww/comments/89s9ga/patient_dog_walks_extremely_slow_so_that_the_old/",1070
"Azhaius","While we're at it let's remove taxes altogether and let people decide when they feel like paying to have a pothole fixed or to have firefighters employed.",1,1,"aww","/r/aww/comments/89s9ga/patient_dog_walks_extremely_slow_so_that_the_old/",1070
"pharruk","Here, here!  ",-3,1,"aww","/r/aww/comments/89s9ga/patient_dog_walks_extremely_slow_so_that_the_old/",1070
"texantechsan","I like where your heads at, GarboMan.",-5,1,"aww","/r/aww/comments/89s9ga/patient_dog_walks_extremely_slow_so_that_the_old/",1070
"TheChance","...including me. Well, not last month, but certainly within recent memory. I'm not sure if you're Little White Rubber Thing or Plastic Thing in Cute Bag, but either way, good shit!",1,1,"aww","/r/aww/comments/89s9ga/patient_dog_walks_extremely_slow_so_that_the_old/",1070
"Osama_bin_meming","You're an anarchist as well? Sweet as am I. ",-6,2,"aww","/r/aww/comments/89s9ga/patient_dog_walks_extremely_slow_so_that_the_old/",637
"Caelum_Cantorus","Not if you're an ancap",5,3,"aww","/r/aww/comments/89s9ga/patient_dog_walks_extremely_slow_so_that_the_old/",413
"Osama_bin_meming","Y tho ",-6,4,"aww","/r/aww/comments/89s9ga/patient_dog_walks_extremely_slow_so_that_the_old/",258
"Caelum_Cantorus","Because dismantling hierarchy means all hierarchy. Not just the state. Now shove off.",7,5,"aww","/r/aww/comments/89s9ga/patient_dog_walks_extremely_slow_so_that_the_old/",137
"Osama_bin_meming","Yes so what's the issue? No need to be rude about it... Anarchocapitalism does exactly that, there are no rulers or leaders ",1,6,"aww","/r/aww/comments/89s9ga/patient_dog_walks_extremely_slow_so_that_the_old/",100
"Cocoflash","“I looked, and there before me was a pale horse! Its rider was named Death” - Revelations 6:8",31,0,"aww","/r/aww/comments/89vgwy/majestic/",31
"Papismooth","Don't show that to Geralt.",13,0,"aww","/r/aww/comments/89vgwy/majestic/",31
"robb0688","Hoh. Mahgod. This freaking cat. It's sickeningly cute. I might puke a rainbow.",8,0,"aww","/r/aww/comments/89vgwy/majestic/",31
"ATX_Stig","r/catsonstuff",6,0,"aww","/r/aww/comments/89vgwy/majestic/",31
"Socram007","""Onward my noble steed!""",5,0,"aww","/r/aww/comments/89vgwy/majestic/",31
"Live-lucky","This guy. I can just imagine him saying “Yeah bitch, I’m on a unicorn”",5,0,"aww","/r/aww/comments/89vgwy/majestic/",31
"mnmommy","Meowjestic ",2,0,"aww","/r/aww/comments/89vgwy/majestic/",31
"zytros","Found deadpool’s cat",2,0,"aww","/r/aww/comments/89vgwy/majestic/",31
"Mamatiger","Credit for the OC goes to @peripateticmeg aka Meg Frank.",2,0,"aww","/r/aww/comments/89vgwy/majestic/",31
"jackwillner","Lol lovely kitty",1,0,"aww","/r/aww/comments/89vgwy/majestic/",31
"kylekirwan","You forgot to add an AF :) ",1,0,"aww","/r/aww/comments/89vgwy/majestic/",31
"redditssexiestguy","/aww",1,0,"aww","/r/aww/comments/89vgwy/majestic/",31
"Redhotamale80","Bound for greatness, majestic AF indeed. ",1,0,"aww","/r/aww/comments/89vgwy/majestic/",31
"prollysamee","She's got a rainbow tail too aww 😍",1,0,"aww","/r/aww/comments/89vgwy/majestic/",31
"BatmanisWatching1987","Where did you get the unicorn?",1,0,"aww","/r/aww/comments/89vgwy/majestic/",31
"mark_simus","AF",1,0,"aww","/r/aww/comments/89vgwy/majestic/",31
"PM-ME-CHUBBY-TITTIES","I want it now! ",1,0,"aww","/r/aww/comments/89vgwy/majestic/",31
"jbrace29","Onward to greatness!",1,0,"aww","/r/aww/comments/89vgwy/majestic/",31
"cvilla7","Onwards, Aoshima!",1,0,"aww","/r/aww/comments/89vgwy/majestic/",31
"trampdale11","Toothless ",1,0,"aww","/r/aww/comments/89vgwy/majestic/",31
"lovelysexyazn","Prefect posture ",1,0,"aww","/r/aww/comments/89vgwy/majestic/",31
"SupremeCanadian","Onward, noble steed! To the pate!",1,0,"aww","/r/aww/comments/89vgwy/majestic/",31
"blooppossum","This is fucking great",1,0,"aww","/r/aww/comments/89vgwy/majestic/",31
"khorn7","Why do they call it a unicorn?  It doesn’t have an ear of corn anywhere that I can see. ",1,0,"aww","/r/aww/comments/89vgwy/majestic/",31
"slb7997","Is she sitting side saddle haha such a little lady",1,0,"aww","/r/aww/comments/89vgwy/majestic/",31
"JimmyTheOtherCat","Watch out, Francis.",1,0,"aww","/r/aww/comments/89vgwy/majestic/",31
"kirbstompin","As fuck... ( I hear it has become an universal unit of measurement)",1,0,"aww","/r/aww/comments/89vgwy/majestic/",31
"DrFridayTK","Officially the best picture on the internet. ",1,0,"aww","/r/aww/comments/89vgwy/majestic/",31
"DrQuin305","Brgitte Lindholm",0,0,"aww","/r/aww/comments/89vgwy/majestic/",31
"atk93","I instantly thought of the Witcher and Yen",3,1,"aww","/r/aww/comments/89vgwy/majestic/",3
"Richard825","Our daughter had rats. Great pets. Such personalities. ",230,0,"aww","/r/aww/comments/89t4tq/happy_world_rat_day/",230
"ASeriousGorb","Hes cute now, sure.

Just wait till he starts worshipping the great horned rat with the other skaven",210,0,"aww","/r/aww/comments/89t4tq/happy_world_rat_day/",230
"testwaffles","Happy rat Bruxing. They rub their teeth together when they are happy to make a noise. Then comes the Boggling. I'll admit the first time I saw it I thought my rat was dying. But in reality it's just them letting you know how pleased they are. Video for those who have not seen https://youtu.be/f57HSjD_K8U ",74,0,"aww","/r/aww/comments/89t4tq/happy_world_rat_day/",230
"Thanan160518","ᘛ⁐̤ᕐᐷ we’re the rats ᘛ⁐̤ᕐᐷ",47,0,"aww","/r/aww/comments/89t4tq/happy_world_rat_day/",230
"MrsVR46","Aww, this makes me miss my little babies. One of them would wake up when I came down in the morning and sit on her perch next to me while I had a cuppa.",45,0,"aww","/r/aww/comments/89t4tq/happy_world_rat_day/",230
"Vengeful_Deity","Every day is rat day when you're skaven.",32,0,"aww","/r/aww/comments/89t4tq/happy_world_rat_day/",230
"Traubster_","This video makes me realize that I judge an entire species of pet solely on the fact that I find their teeth terrifying. 

Admittedly, this lil' thing is pretty cute.",22,0,"aww","/r/aww/comments/89t4tq/happy_world_rat_day/",230
"holydana","I had 2 rats for a while, sisters named Bella and Donna. Every time I cleaned out their cage I gave them a new empty tissue box to sleep and snuggle in. Rats can be real sweeties.. I can't believe some people are completely repulsed by them.",22,0,"aww","/r/aww/comments/89t4tq/happy_world_rat_day/",230
"DaSpice","I want one! But I have two cats with strong hunting instincts:-(",20,0,"aww","/r/aww/comments/89t4tq/happy_world_rat_day/",230
"CallejaFairey","Except here in Alberta, Canada, where rats are illegal 😭.",16,0,"aww","/r/aww/comments/89t4tq/happy_world_rat_day/",230
