"author","body","score","depth","subreddit","permalink","max_score_at_depth"
"PM_ME_YOUR_BOOBS_352","DOGS CAN SMILE ",225,0,"aww","/r/aww/comments/89w605/sometimes_i_catch_her_just_staring_and_smiling_at/",225
"Coffeeboiler","Happiness is...this",125,0,"aww","/r/aww/comments/89w605/sometimes_i_catch_her_just_staring_and_smiling_at/",225
"mydogbuddha","I could wake up to that smile for the rest of my life. 

Instead I wake up to my dog farting and giving me a look as if it was me 😠",55,0,"aww","/r/aww/comments/89w605/sometimes_i_catch_her_just_staring_and_smiling_at/",225
"The_GuyFromThe_Thing","It’s pics like these that make me envy the day I get my first dog",48,0,"aww","/r/aww/comments/89w605/sometimes_i_catch_her_just_staring_and_smiling_at/",225
"nguoiphanxu","this smile is the stress reliever after a hard day",31,0,"aww","/r/aww/comments/89w605/sometimes_i_catch_her_just_staring_and_smiling_at/",225
"MermaidSwimmer","G O L D E N B O Y E 

I miss my golden :( We had to put him down rather suddenly a few years back, due to his back legs no longer working, and the suggestion of invasive surgery to remove his spleen at such an old age. His name was Frosty, and he is the bestest dog I've ever had. 

I hope you have many more wonderful years with your girl. She looks like a happy, laid back dog!",30,0,"aww","/r/aww/comments/89w605/sometimes_i_catch_her_just_staring_and_smiling_at/",225
"alightkindofdark","I literally aww’ed. 😊",16,0,"aww","/r/aww/comments/89w605/sometimes_i_catch_her_just_staring_and_smiling_at/",225
"dantheman2108","I want a girl that looks at me the same way your dog looks at you",14,0,"aww","/r/aww/comments/89w605/sometimes_i_catch_her_just_staring_and_smiling_at/",225
"DeterministDiet","/r/DogsMirin",6,0,"aww","/r/aww/comments/89w605/sometimes_i_catch_her_just_staring_and_smiling_at/",225
"erinnrose","Too precious, my goodness! ",6,0,"aww","/r/aww/comments/89w605/sometimes_i_catch_her_just_staring_and_smiling_at/",225
"recreationAtion","It’s obvious she is a most loved and cared for girrrrrl :)",4,0,"aww","/r/aww/comments/89w605/sometimes_i_catch_her_just_staring_and_smiling_at/",225
"sonia72quebec","Your place looks really nice.",4,0,"aww","/r/aww/comments/89w605/sometimes_i_catch_her_just_staring_and_smiling_at/",225
"mck22967","Give her a treat. For no other reason than being so pretty ",3,0,"aww","/r/aww/comments/89w605/sometimes_i_catch_her_just_staring_and_smiling_at/",225
"ThatChrisFella","If dogs had their own version of reddit yours would put you in r/aww",5,0,"aww","/r/aww/comments/89w605/sometimes_i_catch_her_just_staring_and_smiling_at/",225
"Bendybabe","Goodest of girls ",3,0,"aww","/r/aww/comments/89w605/sometimes_i_catch_her_just_staring_and_smiling_at/",225
"Raqped","This is the kind of smile I want to receive everyday I came from job. He is so beautiful...",2,0,"aww","/r/aww/comments/89w605/sometimes_i_catch_her_just_staring_and_smiling_at/",225
"TwoGeese","GAWD that FACE!  Angels in furry pants. ",2,0,"aww","/r/aww/comments/89w605/sometimes_i_catch_her_just_staring_and_smiling_at/",225
"OldSpiceSmellsNice","What a cute face. Your decor is spot on, too. What a clean house!",2,0,"aww","/r/aww/comments/89w605/sometimes_i_catch_her_just_staring_and_smiling_at/",225
"Kenmoreland","I think that is,a happy dogger saying my life would be complete with a snack or two (or seventeen.)",1,0,"aww","/r/aww/comments/89w605/sometimes_i_catch_her_just_staring_and_smiling_at/",225
"ey-ks","I just want someone that looks at me the same way she looks at her human",1,0,"aww","/r/aww/comments/89w605/sometimes_i_catch_her_just_staring_and_smiling_at/",225
"dunnkw","I’d kiss that face all day.",1,0,"aww","/r/aww/comments/89w605/sometimes_i_catch_her_just_staring_and_smiling_at/",225
"SeeYuLater","You are very lucky",1,0,"aww","/r/aww/comments/89w605/sometimes_i_catch_her_just_staring_and_smiling_at/",225
"figgitygoofedup","She is very photogenic ",1,0,"aww","/r/aww/comments/89w605/sometimes_i_catch_her_just_staring_and_smiling_at/",225
"DITCHWORK","What a good girl..  My mom has a Golden and she is so sweet and soft.  You’re lucky to have her.",1,0,"aww","/r/aww/comments/89w605/sometimes_i_catch_her_just_staring_and_smiling_at/",225
"Kelldogs","Wishing the camera was turned the other way so I could experience double happiness",1,0,"aww","/r/aww/comments/89w605/sometimes_i_catch_her_just_staring_and_smiling_at/",225
"rheyniachaos","This is the same face i make when i see adorable doggos like her 💖💖",1,0,"aww","/r/aww/comments/89w605/sometimes_i_catch_her_just_staring_and_smiling_at/",225
"WhimsicalRenegade","...Looks like you’re her precious love.",1,0,"aww","/r/aww/comments/89w605/sometimes_i_catch_her_just_staring_and_smiling_at/",225
"OscarTheBug","This post made me happy ",1,0,"aww","/r/aww/comments/89w605/sometimes_i_catch_her_just_staring_and_smiling_at/",225
"rgnadt_10","This warms my stone cold heart",1,0,"aww","/r/aww/comments/89w605/sometimes_i_catch_her_just_staring_and_smiling_at/",225
"gimme_5_legs","So beautiful. I had a golden as a kid, he had a great smile too.",1,0,"aww","/r/aww/comments/89w605/sometimes_i_catch_her_just_staring_and_smiling_at/",225
"stinkybeers","She’s reminding you that you’re her favourite person.",1,0,"aww","/r/aww/comments/89w605/sometimes_i_catch_her_just_staring_and_smiling_at/",225
"trexreturns","And you hers.",1,0,"aww","/r/aww/comments/89w605/sometimes_i_catch_her_just_staring_and_smiling_at/",225
"matty80","In the spirit of this sub, I can quite honestly say that literally made me go ""aww!"". So I got my wife in to look and SHE DID IT TOO.

That is a lovely, lovely dog. ",1,0,"aww","/r/aww/comments/89w605/sometimes_i_catch_her_just_staring_and_smiling_at/",225
"avamonroe","😍",1,0,"aww","/r/aww/comments/89w605/sometimes_i_catch_her_just_staring_and_smiling_at/",225
"icon99","I don't know why but this picture looks scary",1,0,"aww","/r/aww/comments/89w605/sometimes_i_catch_her_just_staring_and_smiling_at/",225
"AtomicNinja","I love that you love each other so much. :)",1,0,"aww","/r/aww/comments/89w605/sometimes_i_catch_her_just_staring_and_smiling_at/",225
"bob1981666"," A good girlie if I ever saw one!",1,0,"aww","/r/aww/comments/89w605/sometimes_i_catch_her_just_staring_and_smiling_at/",225
"HadoMaster1992","Does the sweetie have a name? 💖",1,0,"aww","/r/aww/comments/89w605/sometimes_i_catch_her_just_staring_and_smiling_at/",225
"jgoorn","Fren",1,0,"aww","/r/aww/comments/89w605/sometimes_i_catch_her_just_staring_and_smiling_at/",225
"birdyroger","I see Divinity in such sweetness.",0,0,"aww","/r/aww/comments/89w605/sometimes_i_catch_her_just_staring_and_smiling_at/",225
"BrilliantWeb","You got me to exclaim, ""aww, sweet girl!"" aloud. ",0,0,"aww","/r/aww/comments/89w605/sometimes_i_catch_her_just_staring_and_smiling_at/",225
"Anewdaytomorrow","Dogs can't look up",12,1,"aww","/r/aww/comments/89w605/sometimes_i_catch_her_just_staring_and_smiling_at/",67
"Pookieeatworld","My lab does this, when I go home, he will sit in whatever room I'm in and just give me the most adoring looks, cuz he loves his Pookie so much... ",4,1,"aww","/r/aww/comments/89w605/sometimes_i_catch_her_just_staring_and_smiling_at/",67
"benalexnewman","But they actually cant",4,1,"aww","/r/aww/comments/89w605/sometimes_i_catch_her_just_staring_and_smiling_at/",67
"ffandyy","Can they tho ",0,1,"aww","/r/aww/comments/89w605/sometimes_i_catch_her_just_staring_and_smiling_at/",67
"LazyFairAttitude","r/dogsmirin ",1,1,"aww","/r/aww/comments/89w605/sometimes_i_catch_her_just_staring_and_smiling_at/",67
"twiggbert","Yes, no matter how bad my day is, she brings me joy. ",67,1,"aww","/r/aww/comments/89w605/sometimes_i_catch_her_just_staring_and_smiling_at/",67
"ashbyashbyashby","Your sentence makes no sense.",-24,1,"aww","/r/aww/comments/89w605/sometimes_i_catch_her_just_staring_and_smiling_at/",67
"twiggbert","Thank you!  She is the best part of every day for me. I’m sorry to hear about Frosty, but sounds like he had very caring and loving parents.  :)",12,1,"aww","/r/aww/comments/89w605/sometimes_i_catch_her_just_staring_and_smiling_at/",67
"NotKevinJames","• &nbsp;G &nbsp;O &nbsp;L &nbsp;D &nbsp;Y &nbsp;G &nbsp;R &nbsp;R &nbsp;L &nbsp;•",1,1,"aww","/r/aww/comments/89w605/sometimes_i_catch_her_just_staring_and_smiling_at/",67
"nightintheslammer","You may find a girl like that, but it won't be the same. Try telling her to sit and see how she reacts. I'm guessing this one in the pic has no problem with sitting on command. It probably can catch a hot dog in its mouth from 10 feet away. Dogs are more valuable than we give them credit for.",13,1,"aww","/r/aww/comments/89w605/sometimes_i_catch_her_just_staring_and_smiling_at/",67
"whatupMrFlowers","Dogs look up when they howl.",8,2,"aww","/r/aww/comments/89w605/sometimes_i_catch_her_just_staring_and_smiling_at/",21
"nottheworstmanever","My corgi mix can. ",6,2,"aww","/r/aww/comments/89w605/sometimes_i_catch_her_just_staring_and_smiling_at/",21
"BiZzles14","Yes, yes they can. This post is definitive proof of such",4,2,"aww","/r/aww/comments/89w605/sometimes_i_catch_her_just_staring_and_smiling_at/",21
"NeedysaurousRex","My dog looks up and I see all the ungodly whites of his eyes. Like I actually get lowkey mad at him bc it creeps me tf out 
",1,2,"aww","/r/aww/comments/89w605/sometimes_i_catch_her_just_staring_and_smiling_at/",21
"IslandSparkz","Her fur is so Smooth, you're a good owner",21,2,"aww","/r/aww/comments/89w605/sometimes_i_catch_her_just_staring_and_smiling_at/",21
"Janeiskla","It's really not that hard to understand",7,2,"aww","/r/aww/comments/89w605/sometimes_i_catch_her_just_staring_and_smiling_at/",21
"Pokemaster131","Dogs howl when they look up",3,3,"aww","/r/aww/comments/89w605/sometimes_i_catch_her_just_staring_and_smiling_at/",3
"ffandyy","I don’t think anyone has proved it, but I’m happy to take your word for it ",1,3,"aww","/r/aww/comments/89w605/sometimes_i_catch_her_just_staring_and_smiling_at/",3
"ashbyashbyashby","I know what they mean from context, they're ***looking forward*** to having a dog. They just said it weird. How can you be jealous of a DAY in the future?",-1,3,"aww","/r/aww/comments/89w605/sometimes_i_catch_her_just_staring_and_smiling_at/",3
"GmOnEy4L1fE","Everything in the world is either a dog or not a dog",1,4,"aww","/r/aww/comments/89w605/sometimes_i_catch_her_just_staring_and_smiling_at/",1
"SilkyMacchiato","But where are they going? Who are they meeting? 
I NEED CLOSURE",2301,0,"aww","/r/aww/comments/89ulyl/such_a_cute_surprise/",2301
"stanleyfarnsworth","**DOG SAFETY PSA:** ALWAYS CARRY DOG ON ESCALATOR. THEIR CLAWS CAN GET CAUGHT IN THE TEETH AT THE END AND SHRIEKING SHRIEKING MAIMED DOGGO!!!

ALWAYS TAKE ELEVATOR!!! ",617,0,"aww","/r/aww/comments/89ulyl/such_a_cute_surprise/",2301
"aeosyn","I want a puppy and flowers and heart balloons... 😩",435,0,"aww","/r/aww/comments/89ulyl/such_a_cute_surprise/",2301
"Rev_Punch","The surprise ""Honey, I've met someone else and we're in love. Goodbye""",259,0,"aww","/r/aww/comments/89ulyl/such_a_cute_surprise/",2301
"ragonk_1310","Full court press on pantry dropping efforts by that chap.",211,0,"aww","/r/aww/comments/89ulyl/such_a_cute_surprise/",2301
"anniewolfe","YES, CRAIG! I WILL MARRY YOU!!! - anyone probably",107,0,"aww","/r/aww/comments/89ulyl/such_a_cute_surprise/",2301
"JohnOliversPenis","I love this and that dog is adorable, but as a New Yorker I’m getting anxiety that no one is standing to one side to let the walkers through ",90,0,"aww","/r/aww/comments/89ulyl/such_a_cute_surprise/",2301
"AmericanKamikaze","Ma boy just wants to get LAID. Respect. ",63,0,"aww","/r/aww/comments/89ulyl/such_a_cute_surprise/",2301
"Infected_Cunt_Wart","I'm trying to process what the hell he did wrong to warrant getting these type of apology gifts",51,0,"aww","/r/aww/comments/89ulyl/such_a_cute_surprise/",2301
"Quicksplice","I’m surprised he couldn’t just float down with all those balloons. 

Edit: just put your thumb over the escalator.  ",45,0,"aww","/r/aww/comments/89ulyl/such_a_cute_surprise/",2301
"BooStickTime","Dont you dare drop me",19,0,"aww","/r/aww/comments/89ulyl/such_a_cute_surprise/",2301
"ramsfannorth13","What kind of dog is that",7,0,"aww","/r/aww/comments/89ulyl/such_a_cute_surprise/",2301
"Oops639","That dog is going to get lucky on this date night out.",8,0,"aww","/r/aww/comments/89ulyl/such_a_cute_surprise/",2301
"jewbert265","I was so confident that dog was gonna puke",5,0,"aww","/r/aww/comments/89ulyl/such_a_cute_surprise/",2301
"Archmage_Falagar","I hope he doesn't drop the dog or it would float away.",5,0,"aww","/r/aww/comments/89ulyl/such_a_cute_surprise/",2301
"Adamrawn","What did that guy do his wife? ",3,0,"aww","/r/aww/comments/89ulyl/such_a_cute_surprise/",2301
"westendtown","Martha my dear!",3,0,"aww","/r/aww/comments/89ulyl/such_a_cute_surprise/",2301
"hksginger","Adorable! But is the dog his date or the gift? So much confusion 🤪",4,0,"aww","/r/aww/comments/89ulyl/such_a_cute_surprise/",2301
"Cedargal","How I would like my future hub to propose to me... #daydreaming",4,0,"aww","/r/aww/comments/89ulyl/such_a_cute_surprise/",2301
"SilverJunglist","That's one hell of a sorry. Wonder what he did?",3,0,"aww","/r/aww/comments/89ulyl/such_a_cute_surprise/",2301
"thephoqueen","I hope the dog knows [this trick](https://youtu.be/qXo3NFqkaRM) ",3,0,"aww","/r/aww/comments/89ulyl/such_a_cute_surprise/",2301
"mowble","I’m feeling really disappointed by my relationships right now, because while all the rest of you except like, 3, are like awwwwww how sweet, I’m like this guy is a manipulative conniving mother Fuck that is putting in a huge display to make strangers gush, because he’s spent the last 2 weeks being an abusive, emotionally exhausting, controlling asshole. I bet he’s called her parents there to watch it all go down too. I think I need another therapist . ",3,0,"aww","/r/aww/comments/89ulyl/such_a_cute_surprise/",2301
"sporket","*Shortly after he sings* Lady and the.... craammmp!! Owww... my back! ",2,0,"aww","/r/aww/comments/89ulyl/such_a_cute_surprise/",2301
"krismon","She's a lucky pooch! ",2,0,"aww","/r/aww/comments/89ulyl/such_a_cute_surprise/",2301
"Rolex2988","I bet the story goes that dog and man were separated and they met after so long so that was the surprise for the man. Cause he finally got to meet his dog.",2,0,"aww","/r/aww/comments/89ulyl/such_a_cute_surprise/",2301
"dukunt","Anyone remember the Mr. Muggs books? I remember learning how to read in grade 1 by reading about a big sheep dog named Mr. Muggs but I can't find anyone else who read those books. (Im starting to question my sanity)",2,0,"aww","/r/aww/comments/89ulyl/such_a_cute_surprise/",2301
"punkprinc3ss19","I would love to be surprised like this, it’s so cute!",2,0,"aww","/r/aww/comments/89ulyl/such_a_cute_surprise/",2301
"boring420","Literally everyone is smiling ",2,0,"aww","/r/aww/comments/89ulyl/such_a_cute_surprise/",2301
"captain_joe6","That whole combo just screams “divorced in three months” to me. ",2,0,"aww","/r/aww/comments/89ulyl/such_a_cute_surprise/",2301
"Scethrow","What’s the surprise?....",1,0,"aww","/r/aww/comments/89ulyl/such_a_cute_surprise/",2301
"leisdrew","Is that fucking Jim gaffigan?! ",1,0,"aww","/r/aww/comments/89ulyl/such_a_cute_surprise/",2301
"fookajew","Was looking for the Rick and Morty slow ship ramp deployment reference but don't see it, am disappointed",1,0,"aww","/r/aww/comments/89ulyl/such_a_cute_surprise/",2301
"Curlyjr3365","Tim Allen?",1,0,"aww","/r/aww/comments/89ulyl/such_a_cute_surprise/",2301
"Megablast66","What kind of dog, he is so cute!!!",1,0,"aww","/r/aww/comments/89ulyl/such_a_cute_surprise/",2301
"TaquitoPartyat330","Gotta love doodle hugs ",1,0,"aww","/r/aww/comments/89ulyl/such_a_cute_surprise/",2301
"captain_crowfood","That dudes valentine is a bitch.",1,0,"aww","/r/aww/comments/89ulyl/such_a_cute_surprise/",2301
"liquidhorses","This is like you coming down the stairs with Chewie and flowers for me u/rigehl",1,0,"aww","/r/aww/comments/89ulyl/such_a_cute_surprise/",2301
"VacationsOver","T H I R S T Y",1,0,"aww","/r/aww/comments/89ulyl/such_a_cute_surprise/",2301
"whetthefuck_","damn can i steal his valentine?",1,0,"aww","/r/aww/comments/89ulyl/such_a_cute_surprise/",2301
"vguy72","My Man! 👊",1,0,"aww","/r/aww/comments/89ulyl/such_a_cute_surprise/",2301
"thegrommet","That dude must have fucked up pretty bad.",1,0,"aww","/r/aww/comments/89ulyl/such_a_cute_surprise/",2301
"kaytea30","this guy sets the bar high",1,0,"aww","/r/aww/comments/89ulyl/such_a_cute_surprise/",2301
"ockyyy","Dog looks sweet too! ;)",1,0,"aww","/r/aww/comments/89ulyl/such_a_cute_surprise/",2301
"jasmineana","lovely :) the balloons and the surprise of course ",1,0,"aww","/r/aww/comments/89ulyl/such_a_cute_surprise/",2301
"Nicox37","Inb4 I only see you as a friend",1,0,"aww","/r/aww/comments/89ulyl/such_a_cute_surprise/",2301
"dogy59","Is the dog a present for his date? Or is the dog his date...",1,0,"aww","/r/aww/comments/89ulyl/such_a_cute_surprise/",2301
"PM_ME_YOUR_NALA_PICS","i wish him and that dog a wonderful future together",1,0,"aww","/r/aww/comments/89ulyl/such_a_cute_surprise/",2301
"conairthehairdryer","""And I presume some of them are good boyes too""",1,0,"aww","/r/aww/comments/89ulyl/such_a_cute_surprise/",2301
"wastedbud2","A surprise to be sure, but a welcome one",1,0,"aww","/r/aww/comments/89ulyl/such_a_cute_surprise/",2301
"shibino","My animal shelter sense can't help but to make me say I hope the gift doesn't get refunded. Help lol",1,0,"aww","/r/aww/comments/89ulyl/such_a_cute_surprise/",2301
"MrsMinnesotaNice","GIFs that end to soon",1,0,"aww","/r/aww/comments/89ulyl/such_a_cute_surprise/",2301
"dofyk","Cute ",1,0,"aww","/r/aww/comments/89ulyl/such_a_cute_surprise/",2301
"OneGoodRib","It's sweet he got his dog balloons since it can't eat chocolate",1,0,"aww","/r/aww/comments/89ulyl/such_a_cute_surprise/",2301
"crispy_attic","I hope they put down a wet floor sign.",1,0,"aww","/r/aww/comments/89ulyl/such_a_cute_surprise/",2301
"PsiSangBoom","It's just a guy taking his bitch out for date night, calm down",1,0,"aww","/r/aww/comments/89ulyl/such_a_cute_surprise/",2301
"They_Cut_The_Fleeb","What kind of dog?",1,0,"aww","/r/aww/comments/89ulyl/such_a_cute_surprise/",2301
"Cujjob"," I hear she's a real bitch.",1,0,"aww","/r/aww/comments/89ulyl/such_a_cute_surprise/",2301
"BlazeDaddy69","Is that dog running for president? Because that was a long escalator ride",1,0,"aww","/r/aww/comments/89ulyl/such_a_cute_surprise/",2301
"orangesushi411","I’d marry the man just to pet the fluffy boy",1,0,"aww","/r/aww/comments/89ulyl/such_a_cute_surprise/",2301
"_ImYouFromTheFuture_","I just wanted him to pee... so disappointed.",1,0,"aww","/r/aww/comments/89ulyl/such_a_cute_surprise/",2301
"TheWhyteMaN","Hahah that fuckin' dog is killing me!",1,0,"aww","/r/aww/comments/89ulyl/such_a_cute_surprise/",2301
"pr1ntscreen","That dog is just so happy to be a part of whatever is going on lol",1,0,"aww","/r/aww/comments/89ulyl/such_a_cute_surprise/",2301
"alexisdr","So nice of that dog to bring that poor human home",1,0,"aww","/r/aww/comments/89ulyl/such_a_cute_surprise/",2301
"excitement2k","His high school math teacher.",1,0,"aww","/r/aww/comments/89ulyl/such_a_cute_surprise/",2301
"SpookyGhostDidIt","Someone wants to get laid",1,0,"aww","/r/aww/comments/89ulyl/such_a_cute_surprise/",2301
"bobnobjob","That dude must have fucked up **SO BAD**",1,0,"aww","/r/aww/comments/89ulyl/such_a_cute_surprise/",2301
"blackskybluedeath","I heard about this one... These promposals just keep getting more and more wild. Supposedly this kid got his dog to bring in a cute middle-aged white man bec he knew she can never say no to them. ",1,0,"aww","/r/aww/comments/89ulyl/such_a_cute_surprise/",2301
"miss77nld","Man of the Year award!!",1,0,"aww","/r/aww/comments/89ulyl/such_a_cute_surprise/",2301
"SovereignPaladin","Really disappointed at the lack of a surprise. If you've seen the first second you've seen the whole gif.",1,0,"aww","/r/aww/comments/89ulyl/such_a_cute_surprise/",2301
"Armani_Chode","What a cute couple. 

Where is this legal? asking for a friend",1,0,"aww","/r/aww/comments/89ulyl/such_a_cute_surprise/",2301
"jjjeffery","Does everyone's smile get bigger as they get closer?",1,0,"aww","/r/aww/comments/89ulyl/such_a_cute_surprise/",2301
"the_shaman","What surprise?  Who was surprised?  I need answers.",1,0,"aww","/r/aww/comments/89ulyl/such_a_cute_surprise/",2301
"foodwithmyketchup","He must have done something seriously wrong ",1,0,"aww","/r/aww/comments/89ulyl/such_a_cute_surprise/",2301
"Mastagon","Such a big boy!",1,0,"aww","/r/aww/comments/89ulyl/such_a_cute_surprise/",2301
"FlintstonePhone","It's cute now, but 4 years from now when that dog is president you'll be wishing you didn't upvote this.  ",1,0,"aww","/r/aww/comments/89ulyl/such_a_cute_surprise/",2301
"Dwayne_dibbly","His girlfriend is a bit of a dog eh. ",1,0,"aww","/r/aww/comments/89ulyl/such_a_cute_surprise/",2301
"Polar0007","The puppy seems so happy",1,0,"aww","/r/aww/comments/89ulyl/such_a_cute_surprise/",2301
"CaliAshy","Oh god. Is this dog running for President?",1,0,"aww","/r/aww/comments/89ulyl/such_a_cute_surprise/",2301
"iier","Me when I cheat my gf",1,0,"aww","/r/aww/comments/89ulyl/such_a_cute_surprise/",2301
"eldergeekprime","Gonna have some difficulty fitting that in your Miata for the drive home.",1,0,"aww","/r/aww/comments/89ulyl/such_a_cute_surprise/",2301
"mebeonreddit","This is my pet hate. Standing on a down escalator.

Lazy motherfuckers
",1,0,"aww","/r/aww/comments/89ulyl/such_a_cute_surprise/",2301
"clarque_","It's a disguise. The dog has a subpoena. ",1,0,"aww","/r/aww/comments/89ulyl/such_a_cute_surprise/",2301
"TheeBlazingOne","The dog looks so adorable in that position, but I can't help but think the smell of that dog in such close proximity.",1,0,"aww","/r/aww/comments/89ulyl/such_a_cute_surprise/",2301
"whatsupdanny","I like to imagine he’s meeting someone at the airport. I want heart balloons and my doggo there when I come home too. ",1,0,"aww","/r/aww/comments/89ulyl/such_a_cute_surprise/",2301
"AlexandriaLitehouse","I don't think I've ever known love before this gif.",1,0,"aww","/r/aww/comments/89ulyl/such_a_cute_surprise/",2301
"YellowcardFTW","That's a power stance if I've ever seen one.",1,0,"aww","/r/aww/comments/89ulyl/such_a_cute_surprise/",2301
"dangoodspeed","Doggo for president 2020.",0,0,"aww","/r/aww/comments/89ulyl/such_a_cute_surprise/",2301
"moobie69","I hate it when people don’t walk on escalators ",0,0,"aww","/r/aww/comments/89ulyl/such_a_cute_surprise/",2301
"kant12","Don't block the escalator like that. so annoying.",0,0,"aww","/r/aww/comments/89ulyl/such_a_cute_surprise/",2301
"bingingbongos","Plot twist: the balloons and flowers are for the doggo. L O V E R B O Y E.",0,0,"aww","/r/aww/comments/89ulyl/such_a_cute_surprise/",2301
"audreyt92","That’s all for the doggo right?",0,0,"aww","/r/aww/comments/89ulyl/such_a_cute_surprise/",2301
"crankyjerkass","She looks hideous!",-1,0,"aww","/r/aww/comments/89ulyl/such_a_cute_surprise/",2301
"Kazikian","Trump announcing his candidacy in 2020",-1,0,"aww","/r/aww/comments/89ulyl/such_a_cute_surprise/",2301
"NedLuddIII","I'm made too anxious by the people on the left who aren't moving to enjoy this gif ",-1,0,"aww","/r/aww/comments/89ulyl/such_a_cute_surprise/",2301
"DerDonald","And that dog became President of the United States",-1,0,"aww","/r/aww/comments/89ulyl/such_a_cute_surprise/",2301
"haamfish","It really stresses me out that he’s blocking the whole escalator ",-2,0,"aww","/r/aww/comments/89ulyl/such_a_cute_surprise/",2301
"jtaylor807","Wow. That dude is so cook",-2,0,"aww","/r/aww/comments/89ulyl/such_a_cute_surprise/",2301
"PM_me_GOODSHIT","Looking at this dog ride down reminds of the day Trump announced he was running for President. His beautiful mane, the love of America and its people were on full display that history making day. It makes me proud to live in this great land of opportunity. ",-5,0,"aww","/r/aww/comments/89ulyl/such_a_cute_surprise/",2301
"PhiliusX","White people. ",-9,0,"aww","/r/aww/comments/89ulyl/such_a_cute_surprise/",2301
"flickflack1","And then he became the president.",-10,0,"aww","/r/aww/comments/89ulyl/such_a_cute_surprise/",2301
"porgy_tirebiter","As long as the dog doesn’t then give a speech about Mexico sending us their rapists and drug dealers.",-11,0,"aww","/r/aww/comments/89ulyl/such_a_cute_surprise/",2301
"cosmos_jm","He just proposed to the dog. hint: she said yes.",822,1,"aww","/r/aww/comments/89ulyl/such_a_cute_surprise/",822
"molotovmimi","I think we are missing so much context, but then as they get closer and closer, it just keeps getting better because there are so many balloons, and the flowers, and the dog. The dog! He's just so chill going down the escalator!",313,1,"aww","/r/aww/comments/89ulyl/such_a_cute_surprise/",822
"DrAwesomeThrowAway","I like to think the dog is the guys valentine date and there's something in the mall that the dog really enjoys. ",20,1,"aww","/r/aww/comments/89ulyl/such_a_cute_surprise/",822
"elushinz","r/gifsthatendedtoosoon",15,1,"aww","/r/aww/comments/89ulyl/such_a_cute_surprise/",822
"Bobyyyyyyyghyh","Probably to the bottom of the escalator",15,1,"aww","/r/aww/comments/89ulyl/such_a_cute_surprise/",822
"Connedman","He was just on a date with his fiance and received all those things as a valentine's gift, I want to believe this, where my sugah mommas at?",5,1,"aww","/r/aww/comments/89ulyl/such_a_cute_surprise/",822
"Mr_frumpish","That's the surprise.",2,1,"aww","/r/aww/comments/89ulyl/such_a_cute_surprise/",822
"LadyEnvy","All you need to know is it ends with that guy getting laid. ",1,1,"aww","/r/aww/comments/89ulyl/such_a_cute_surprise/",822
"SeeYuLater","On Date.",1,1,"aww","/r/aww/comments/89ulyl/such_a_cute_surprise/",822
